Comment ID,Username,Comment
dd7i1zh,polashel,"They realized long ago that they don't need to debate shit. They just need to seize control of power structure and important companies, like social media/media."
dd7phde,tyrannosaurus_fl3x,"Correction, they realized that they can't debate."
dd86fvm,CapAm91,"Correction, they realized you cant debate with stupid."
dd9th51,Anonymous_Ascendent,I let the facts do the debating.http://imgur.com/a/D7DD9
dd84mg1,,https://www.youtube.com/watch?v=U06jlgpMtQs
dd84mxt,youtubefactsbot,">[**National Anthem of USSR [3:45]**](http://youtu.be/U06jlgpMtQs)>>The mighty anthem of USSR.> [*^rascrifice*](https://www.youtube.com/channel/UCFiVxE2bjLpxmisd_rl9e6g) ^in ^News ^& ^Politics>*^9,585,706 ^views ^since ^May ^2008*[^bot ^info](/r/youtubefactsbot/wiki/index)"
dd8k88z,PM-ME-YOUR-DOGPICS,"It's not about debate, Reddit is a tool to make money through ads and paid promotion, they see r/altright as detrimental to their profits, they ban it. Here's a newsflash for you though little buddy: it's their site, you're using it, they can shape it as they please.If you're not okay with that, create your own little altright website and go play there."
dd9qblj,SocialNationalism,"> it's their site, you're using it, they can shape it as they please.https://www.youtube.com/watch?v=YKjPI6no5ng"
dd83dto,,I love it when ppl throw around blanket 'they' statements. Who are 'they'? Are all of 'them' the same?
dd7t5hm,bailbondshhman,u likee pigss fukins?
dd7gmna,dumpster_high_dive,"If their ideologies could be supported facts logic, and stand against ours on its own principles, they wouldn't have had to deny us our voice.But we were winning."
dd7h56l,,[removed]
dd7izar,,[removed]
dd7j58s,,[removed]
dd7u4x9,grandpagangbang,"How old are you? I'm guessing 15. ""The Chan's haven't been compromised"" LOL."
dd84ii1,wm07,i fucking hate the internet my god shut it all down
dd8ucip,randyjohnsonsjohnson,Seriously. Black people? Muslims? Fuck all that. The real people that need to be wiped from this planet are 14-21 year old white kids on the Internet.
dd9n9uw,_craiggles_,Ouch
dd88phr,AlleM43,Please specify an amount of computers to be ADDOS'ed.(This is a joke)
ddbcdmm,winlifeat,What is addos
dd7z5nf,Yellow-5-Son,"This guy is a liberal troll planting false flags. Do not believe him, read his comment history for proof."
dd9qdk6,SocialNationalism,The guy you're replying to is probably a plant too funnily enough. It just takes two accounts to create a fake conversation chain.
dd9x8u4,Yellow-5-Son,JumbledFun is the guy I was saying is a troll.
dd7np7g,Quaddro21,Y so sensitive
dd7ns3w,JumbledFun,Because you cucks at the_JewGrandpa sold out the altright just like you sold out your people and I'm tired of it. Rally brothers let's make these cucks' lives hell! Fuck these fake assholes and their concern trolling
dd7o7vq,,[removed]
dd7odc2,JumbledFun,"oh i bet you are one of those ""pol is just satire"" cucks aren't you. Fuck off and keep sucking on that (((globalist))) dick"
dd7pzli,Duffalpha,">Be civil: Absolutely no racial slurs. You are here to have a serious and civil factual, philosophical and ideological discussion."
dd7z20c,Yellow-5-Son,/u/JumbledFun is a liberal troll. He's been doing this shit all day. Do not believe anything he says.
dd7q4vo,JumbledFun,Oh look another little snowflake from the_JewGrandpa is here to tone police after stabbing the movement in the back
dd7q93f,,[removed]
dd7qdc8,JumbledFun,"More proof guys if there was any doubt! Look at schlomo crawl out from under his rock, was there ever any doubt who controls the_donald?"
dd7uv53,Kingca,"There is nothing more historically goddamn American than punching Nazis. Suck on this throbbing, circumcised dick."
dd7yvbo,Yellow-5-Son,"Lol, that was debunked. Captain America, and Indiana Jones were both created by Jews. Nothing American about it at all."
dd7yybn,AS14K,"Damn man, get it together."
dd7zd08,Yellow-5-Son,Judaism is not American. Deal with it.
dd7znvv,AS14K,Hahaha what? Maaaan snap out of it!
dd800az,Yellow-5-Son,"I would say the same to you. You just repeat the same talking points the left has drilled into you for years. The mainstream media is controlled by a very (((small))) percentage of the population. Expand your mind, think critically, and challenge your current ideas. Don't think a certain way just because it is popular, or trendy. Think about what makes sense and what is right."
dd824f9,AS14K,Haha what? Holy shit what are you talking about?
dd84mgu,BrownieSundown,You are literally repeating the same thing you see in those 911truth videos lmao
dd84uoh,,"LOL, DONT FORGET TO>EXPAND YOUR MINDEVERYONE."
dd87oby,artificialgreeting,It is generally known that expanding one's mind inevitably leads to hate against jews. ^/s
dd89nnp,untide,You're just repeating the same points the altright has drilled into you for a few months you fucking puppet.
dd8d4be,,And you're not at all disputing the point that American media and culture is controlled by Jews. Jews who considers themselves separate from white Americans with distinct interests.
dd8dfpv,untide,You're right I didn't dispute the point that American media and culture is controlled by Jews. How astute of you to recognize that the subject of my comment had nothing to do with Jews.
dd8diyt,im_not_a_writer,Let's not pretend the Jews don't know what they're doing. They know exactly what they're doing.
dd8l55f,,"And they woulda got away with it too, if it wasn't for you pesky alt righters."
dd8lqca,The_GASK,THERE IS NOT ENOUGH POPCORN IN MY HOUSE TO WITNESS THIS NAZI PUNCHING.
dd8j88e,DamonHarp,Why is it bad that different communities don't identify as white?Seems pretty natural that different cultures would have different... cultures.
dd977ks,,Educate yo'self![Jews in Hollywood.](http://rense.com/general21/bet.htm)TLDRQuestion - *Who cares?*Answer - *Literally just you and your very tiny bigoted movement.*
dd85qyz,lolwutka,Oh the irony
dd85duk,manys,"So if my mind is being controlled by the Jews, what's the best way to stop doing that? What are the chances I don't even *know* it's happening?"
dd8dntr,KA1N3R,"Get a grip, mate.You're the narrow-minded one."
dd8tf51,Yellow-5-Son,"That's absurd. We allow dissenting viewpoints the right to speak, without getting banned, so much so we created an ENTIRE SUBREDDIT just to debate us! Can your side say the same? Of course not. You just ban us, and silence us by any means necessary. You're welcome for the free speech."
dd8tzi7,KA1N3R,"Not tolerating intolerance isn't intolerance. Also, this is a privately owned Website, so freedom of speech doesn't exist here."
dd8uq7a,Yellow-5-Son,"First of all, that's completely hypocritical. Bogitry is bigotry no matter who the victim. Second of all, we're not intolerant, we just want to see the end of white genocide through 'diversity'. We want America for Americans, European countries for the Europeans, and we want the immigrants to go home. We don't hate anybody, we just love our people, and we love our culture. It's not that complicated."
dd8vkuh,KA1N3R,"But by not tolerating your bigotry, there's overall less bigotry. So, being intolerant towards you = more tolerance. And stop playing the victim card, isn't that what you always blame SJWs for?And...> we just want to see the end of white genocide through 'diversity'statements like these make it really hard for people to understand you, because, frankly, that's biased, racist bullshit."
dd8wjs1,Yellow-5-Son,"Ridiculous, who decides what is bigotry and what isn't, you? So anybody that doesn't agree with you is a bigot? I hope you see the ludicrosity of your argument. And white genocide is a very real problem, and saying so isn't 'racist' it's realist. Europeans have a culture full of esteem that we should be proud of, instead we're told that to have pride in our ancestry is 'racist' and that only everybody else is allowed to do that. It's more hypocrisy. Black pride, brown pride, Asian pride, gay pride, all of these things are celebrated, but white pride? Booo you're a racist for loving your people. Diversity is bringing an end to white culture, and all culture, for that matter. Racial egalitarianism is the bane of civilization and we need to do all we can to stop its spread."
dd8wnfn,KA1N3R,"Whatever, dude. Have fun in the Third Reich."
dd9136i,The_Debtuty,">And white genocide is a very real problemHoly shit man, is this what all alt-righters believe? I hope for your sake you don't spout this shit irl because you won't get very far in life doing that.>but white pride? Booo you're a racist for loving your people. Wtf is ""white pride?"" Pride in white people's accomplishments? Should I be proud of the Renaissance because Italians are kind of white? I don't have a hint of Italian ethnicity btw.>Racial egalitarianism is the bane of civilization and we need to do all we can to stop its spread. So..not all races are equal and some races do not deserve the same rights? Which races deserve more rights, and which ones deserve less?"
dd8xgjq,manys,"What is the point of ""pride in...ancestry?"""
dd8ys3t,Yellow-5-Son,"You're not proud of where you came from? That's what black pride, brown pride, Asian pride all is, pride in their ancestry. It's the same with white pride."
dd8z31t,manys,Isn't pride one of the seven deadly sins?
dd8zd7v,Yellow-5-Son,"Depends on who you ask, I don't believe that personally."
dd919b9,manys,"Ok, so you're not 100% on Christian traditions, just white ones? Where do you draw the line?"
dd89wn0,,[deleted]
dd96d1q,Yellow-5-Son,"Typical left, you have nothing intelligent to say so you resort to anger and name calling."
dd978hv,,[deleted]
dd9854r,Yellow-5-Son,"I don't have any shekels for you, I'm sorry Mr. Troll."
dd8fkr9,floodmfx,Your level of ignorance is astounding
dd8zu8v,cajolingwilhelm,Do you believe that the first people to settle this continent came from Asia across the Bering Sea land bridge during the last ice age? Or do you believe that this is a fictitious conspiracy of the liberal media?
dda4imc,NazzerDawk,"They were Jews that were also American citizens, thus Americans. Are you really that dense?"
ddaeohi,Yellow-5-Son,"We don't have a problem with Joe Q. Jew who lives next door, it's with the overseas Zog and the international Jewry. The people pulling the strings that own the mainstream media."
ddaf3dk,NazzerDawk,"What does ""Zog"" mean? How about ""Jewry""?And why do you think that this ""zog"" is ""pulling the strings""? In what respect are they doing that? To what degree?"
dd7zlvk,nokayy,"Judaism is a religion, it has nothing to do with nationality."
dd8d4qg,,Explain atheist Jews (Israel recognizes those).
dd8ghzc,Augenis,Jews and followers of Judaism are not necessarily the same thing.
dd7zvup,Yellow-5-Son,W E W L A DEWLADTell that to the zionists. That's so ridiculous it's laughable.
dd87k1f,,"Dude, the star of David is on the 1 dollar bill. They put it there after the Jewish helped America in the Revolutionary war. The only thing more American than punching Nazis is punching 18th century Britain, and the Jews helped to that. Literally, the jews have punched Nazis and British with America, that's pretty American."
dd8d5bf,,The Jews financed 18th century Britain too. There's nothing more Jewish than to play all sides of a conflict for profit and power.
dd8j1ht,,[removed]
dd8lkzt,DrMantisTaboggn,"Most of these racist, red-pilled neckbeards probably can't even leave their basements."
dd9j3da,Yellow-5-Son,You've shown me the light with your ad hominems. Oh how I have wronged.
dd8rtc1,broslikethis,"Fuck yeah. I'm with you, brother. I hope they start exposing themselves in the light of day more and quit hiding behind their computer screens. Fucking cowards."
dd9iywi,Yellow-5-Son,"Typical /r/violentleft . We don't primrose violence, but look at you guys go."
dd8u8wl,,"There are right wing safety squads being formed right now, so you'll get your wish. Probably shouldn't try your luck anywhere concealed carry is legal though.If you're worried about guns you could [try your luck in Europe](https://youtu.be/qRI0aQv7b1Q?t=131)."
dd8yxem,TheDarkness3,"You think that crowd of pussies scare me? Fuck off, just because they picked on that old man (typical of your people, it seems.) doesn't mean they can pick on me as easily, let me know what march your gonna be at next and ill show you?"
ddaomu0,continentaldrifting,Now I have a reason to frequent /r/Brogress/Thank you.
dd9j1y3,Yellow-5-Son,"You're such a big, tough, lefty. Notice how leftys are the only ones that threaten violence in these comments? We promote peace and civil discussion, you guys come out of the woodwork with your dicks swinging talking about how lucky we are we don't see you in real life. Then you say WE'RE the intolerant ones. What a fucking joke."
dd9wdec,TheDarkness3,"If you can say the sorta toxic spew you're saying with a straight face I can easily punch you without even thinking twice, you can try to play this bullshit tactic that SJWs use all you want I truly, truly don't give a shit. Ideologies like yours deserve to be eradicated."
dd9xapx,Yellow-5-Son,"SJWs don't do what I'm doing, they do what you're doing. You threaten with violence, then take the moral high ground because it's 'warranted'. You're a hypocrite and a coward."
dda1dd0,TheDarkness3,"You're wasting your time. The day the opinion of someone like you matters to me is the day life's not worth living. Nothing you or infact any of other redditor can say would change my mind, I would smack the shit out of you for sharing the beliefs you share. Anyone who thinks that's wrong doesn't matter to me."
dda1t0m,Yellow-5-Son,>I'm a bigot and anybody that doesn't agree with me is also a bigot but I'm better than them so that gives me the right to hit them. That's what you're saying. Enjoy your fictionalized version of the world on your false moral high-ground with your double standards. You're just too perfect for this world.
dda2lqa,TheDarkness3,"Coming from you? Ha. Ha. You're a failed example of a human. You won't win this one, so give up. You and your other autistic buddy sound like Hitler youths, and you want me to take life lessons from *you*? Cute. If you kill yourself today tell someone to post it on reddit, haven't had a good wank in a while."
ddaebu8,Yellow-5-Son,Ad hominem game strong bruh.
ddarfz2,TheDarkness3,"I look forward to hearing about the success of your ""movement"" and punching your bro's in the face."
dd8u345,Yellow-5-Son,"I suggest you read up on the Jewish Question, you might be surprised to find out that there really is nothing American about Judaism."
dd8a1rw,,[deleted]
dd8d5lc,,That's God-Emperor Trump to you.
dd853qe,,Bigger contributions to American culture than anything you people can claim credit for.
dd8d7sd,,"Yes, Jews are almost entirely responsible for broken families, widespread nihilism, the emotional stuntification of youth everywhere, the open sexual degradation of men and women and childish entertainment like comic book heros, Harry Potter and video games substituting for people having actual lives.Well done Jews."
dd8ei48,herbiems89,Amazing what kind of fantasy world you created for yourself.
dd8ejqc,freerichgangoce,"You could honestly say the same for a wide variety of other people, not just Jews...."
dd8j32j,TheDarkness3,But then he wouldn't be representin' his Hitler-Youth brethrin..
dd8ynos,,"Yeah, but you'd be wrong about everyone but the Jews."
dd9dqho,,"SO what do you think an ""actual life"" is? What are the proper hobbies if not entertainment?"
dd8n3bw,ThealcoholicGoat,TIL I don't have a life because I liked reading Harry Potter.
dd9nwv7,HodgeBros,"Ah yes, the evils of Harry Potter and comic books. We got a manly man over here!"
dd8au8a,,Oh shit!
dd8ca63,Calzin_Z,How aren't Jews American? Like they are American Citizens thus making them American.
dd8dbt9,,"American is a nationality. Being part of a nation requires common blood, common culture, common religion and common language. Jews are not Americans. The only Americans are those Europeans that founded the country and those who later assimilated into that group. IE, Whites only.If you get an Israeli passport you don't suddenly grow curly hair, a big nose, a business sense and lose all your ethics. The same thing holds the other way around too.Unsurprisingly the idea that citizenship equals nationality is an idea pushed by Jews and anyone from before the latter part of the 20th century would have considered you insane for espousing it. A majority of the world still does since all African countries and most of Asia are explicitly racialist and blood based.You can play at being race blind and neutral, but realize that no one else but Whites are doing that."
dd8e5k3,soitcause,">The only Americans are those Europeans that founded the country and those who later assimilated into that group. **IE, Whites only.**The fuck are all the black people they hauled over here 300 years ago, then?"
dd8fwz2,MarmaladeFugitive,"Probably ""inconvenient baggage"" for these shitheads. I don't need the validation of neo nazi scum to know I'm a goddamn American. Honestly, I'd pity them if they didn't feel so recently emboldened by fellow idiots in power."
dd8eapw,greblah,"For fucks sake you do realize that Jews are among the group of Europeans that later assimilated into America, don't you?And the reason only white people pretend to be race blind is because only white people can afford to forget about their ethnicity in America thanks to you fuckers and your white supremacist crap."
dd8tp04,Yellow-5-Son,"LATER assimilated, the graph of Jewish population in America looks like a hockey stick, with their population exploding in the late 1800s. Jews did not help to make America, nor was it created for them."
dd8ui1a,greblah,So we should toss the Irish out too right? Those dirty-lateassimilators
dd8ichq,seanlaw27,You can lick my half Native American half Jewish cock. You don't get to say what a nationality is.
dd8tpxd,Yellow-5-Son,We just did. America is not meant for the Jewish. Deal with it.
dd8v0cb,seanlaw27,"Hate to tell ya homie, but I'm here. Born an American. Work for an American company. Build apps that Americans (including you) use. Pay American taxes and enjoy the same American rights you do. You don't have to like it, you just gotta deal with it."
dd8u6lm,FrenziedMan,Why is America an exclusive club that only the cool kids can get into? That's a really narrow minded and selective thought process.
dd8ujzi,Yellow-5-Son,"Borders are necessary for any civilization, diversity causes the genocide of all distinct cultures. What's your heritage? Would you be happy if your culture was eradicated? That is what the left is trying to do to America, by pumping in people from anywhere they can. We want America for Americans. We want to send the immigrants home, and help out our European brothers and sisters that are fighting the same fight that we are."
dd8vakh,FrenziedMan,"So we came in and destroyed the indians culture. That's a thing. What is ""American Culture""? For a very long time america has been called a ""mixing pot of the world"", which is the exact opposite of what you're saying. Diversity causes acceptance of all different cultures. Understanding others points of views and being empathetic towards it. I don't think you're right on that point. It just makes people a little more open minded to something that really doesn't harm them or affect them in any way. I think any form of ""culture genocide"" you reference can just be chalked up to new generations way of thinking / needs / care.The fact that people here react violently to your views is a bad thing that spawns from close minded though. It causes segregation and linear thought. Our society no longer thinks about *why* we make decisions, we just accept that we make them because they're ""correct"". We don't think about the other decisions, we just refuse to acknowledge them. I understand what you're saying, but I think it's a little hypocritical to call some people ""true americans"", when we literally murdered, plotted, and stole this land from a group of people who truly owned it (were born here and native to the land)."
dd8vz70,Yellow-5-Son,"Practically every country in the world exists at the expense of some group of people or another. The difference with America is we didn't completely eradicate the Native Americans. It's easy to forget about somebody when the don't exist anymore, as is the case with many losing sides in the wars throughout history, but we didn't do that to the Native Americans. And honestly the only people using hateful language here is the left, myself, and other alt-righters included, encourage dissenting viewpoints to be expressed, so we can have calm, civil, meaningful discussion, and I thank you for doing so. Almost all members of the left swear at us, call us names, use hypocritical arguments, then tell us that none of that matters since we don't matter. As far as the white genocide, it truly is a problem. We promote the nuclear family because it's good for civilization as a whole. Different cultures, on different continents, created very similar cultural norms because they realized, independently, that some things are good for civilization, and some are not. Get married, have children, instill good morals, these are the principles that we are promoting. We also want white people to stop being ashamed of their race. White guilt is a very real problem, every culture is allowed to say they're proud to be who they are, and they're celebrated for it, except white people, and that's a problem. European culture is a proud one, full of esteem, and it should be celebrated, along with every other culture. I don't hate anybody, but I fiercely love my own people, and I want what is best for us, just like everybody else."
dd8wn42,FrenziedMan,"I don't think that preaching anti-immigration is the way to solve the issue you outlined. I think general acceptance is the problem, and it's societal. These problems aren't ""new"" per se. People've been preaching that they're being oppressed for years. The internet is allowing people to come together more than ever now. I think people don't realize that they're sort of... echo-chambered into hearing what they want. I think we'll [humanity] will get there eventually. Lots of small sub cultures are spawning due to the internet, as opposed to geographical cultures. It's interesting to see happen. I don't think cultures will just disappear, they'll just become different. I see america as a blank canvas, it is exactly what you decide to make of it. I can be told ""you only think that cause you're white"", but my scope is my scope. I don't understand others' strife (though I can somewhat empathize) but as long as what they want doesn't directly affect my ability to do whatever I want to do with my life (career, hobbies, etc) I'm totes fine with it. As long as no one is getting hurt. Cultures always shift and change, it's how history works. I wouldn't worry too much about becoming a cultureless society, to be honest. Cultures are birthed and die. It's natural."
dd8xdr2,Yellow-5-Son,"It's not that I'm worried so much about becoming a cultureless society, per se, it's which culture will be removed, and which will take its place. At the current trend, white deaths are outpacing white births, which means our population is in decline. Non-white births, however, both domestically and internationally, are experiencing exponential growth. If the current trend continues, of us allowing mass immigration, then white culture will perish, and other cultures will take its place. As far as your comment about it being only natural that cultures are birthed as well as die, I agree, which is why I'm advocating for us to do everything in our power to stop that from happening. I love my culture and do not want to see it die."
dd8ymav,FrenziedMan,"> I love my culture and do not want to see it die.I think over time, (when children are born and stuff) counter-culture has a tendency to develop. Cultures dying is inevitable, and trying to keep them alive through continued reproduction isn't something that's really doable. Kids will end up not liking the way things were done in the past.Japan, for instance, has a terrible, psychologically damaging society, and it's dying off (rapidly, even moreso than whites) there are things right with it (work ethic and dignity are very good things) and there are things wrong with it (too much of a good thing is a bad thing). The best thing to do is understand what went right, what went wrong, and move on and do better next time. I think I'm getting myself off topic. I understand what you mean, and while I don't agree with it, 90% of people standing next to / with you are terrible at voicing their reasons. To me, as a straight white male in america, the things you listed seem like they should be disturbing to my MO, but I couldn't care less. I was rejected by this ""white"" society as a kid, and tbh I don't care much for most ""border-up"" cultures. I understand that not everybody wins, or can perform well, but exclusivity is just a great way to put yourself inside of an echo chamber, and constantly re-affirm your own opinions through the people around you.So I guess we disagree there."
dd9e37b,,"But aren't the jews in control?? Sounds to me like in your worldview you already lost the war. Lol what is it like to be a loser? I'm hispanic, an american citizen, and my girlfriend is white and blonde. I get off to how badly you are losing in your own worldview. Also, Trumps daughter is married to a jew and became jewish lololol, you hateful retards are irrelevant."
