Comment ID,Username,Comment
dd7r8g8,LN2482,What a stupid excuse to ban... Asking to help catch a criminal isn't doxing
dd7sdm0,dissdigg,"That's what I don't get either, wasn't that basically the whole point of subs like r/RBI/ ?"
dd7vu62,tonyp2121,its a witchhunt regardless of if hes a criminal or not. Reddit is not the justice department or the police or the army we cant decide how to punish some random guy for a crime your not a vigilante for fucks sake
dd82qks,LN2482,"Nobody was trying to punish the guy over the internet, only to identify him so it can be forwarded to law enforcement"
dd8o8o6,tonyp2121,as I understand they were doxxing someone as well
dd7kmvm,bannedagainbro,Take a look at what leftist subreddits are saying about violence and r/altright will seem zen-like.
dd7mlzx,SnakesoverEagles,There is nothing threatening about discussing proper baking etiquette. We are only pre-heating our ovens because we are baking some cookies later.
dd7vnre,Sub116610,"As an altright guy, does anyone find talk like yours actually helps our cause? Discuss the JQ all you want, but I find innuendo to murder very detrimental, juvenile, and frankly...stupid.I get you're joking around but still..."
dd7xcy8,SnakesoverEagles,How do you do fellow white man.
dd8d2y8,Sub116610,"German, Irish, Czech, and Polish."
dd7konz,Feathersofaduck,"The Alt-Right mods were straight up assholes about how much they censored people. Even discussing the locale of a public figure you could just google would get your post quickly deleted.They abided by every rule, assuming Reddit didn't add some stupid ""hate speech"" rule lately."
dd7qo9a,,"Oh no, we criticized that really rich, and very politically connected *dominant minority* because they're usually the vanguard of most Anti-Western intellectual movements and media in the world and have a homeland to runaway to when it inevitably all goes to shit. How dare we."
dd7lpzu,Desay,"Straight up bullshit. This is the spin you will be hearing, people.You are allowed to negatively discuss groups. Otherwise about 10,000 other subs would be banned. Everything was kept vague enough and above board that this was in no way special.The second 'point' is a patent lie and rewriting of the narrative."
dd7t7my,werebearbull,"If you have to point out that things were kept vague enough not to be associated with Nazis then you have a problem. People on that forum were calling jewish people sub-human, pigs, calling for genocide. Why should these people be allowed to spread their hate?"
dd8g69g,PM_ME_UR__RECIPES,Your sub got deleted because you guys were participating literal bounty hunting in a stickied post.
dd8j6cx,Mechaniballs,Didn't one of you shoot up a mosque the other day?
dd8n79y,dumpster_high_dive,No. That guy is pro Israel. He's not one of us.
dd90ahp,,[deleted]
dd91ifi,dumpster_high_dive,That's not a technicality at all. It's a core principle of our ideology.
dd7lnv0,cristi1990an,"Yeah, keep saying that to yourself."
dd7omnq,KOWguy,">But we were winning. What makes you think that, out of curiosity?"
dd7w1yf,,"[""facts""](https://i.imgur.com/1TWdEfh.png)You mean your own echo chamber sites just to confirm your beliefs? Man that's pretty much the same as being a SJW who visits buzzfeed and the huffington post who complains that the rest are ignorant of the truth, same bullshit."
dd7wk9u,dumpster_high_dive,Yeah you're right exactly the same except our facts come from places like the FBI.
dd8e4yi,Aerik,"look at this fucking post.when you call your critics ""bolsheviks"" and other shit literally only nazis complain about, _you_ don't get to complain about people not debating you. Or punching you in the face, really."
dd95yp4,xrensa,"> But we were winning.""Earth, Hitler, 1938"" - James T. Kirk, Star Trek 6 - William Shatner"
dd7tvdz,Jurgwug,"God you're an embarrassment to our species. HOW DARE THEY DENY YOUR UBER BIGOTED VOICE that no one wants to hear btw.inb4 ""SJW cuck"""
dd7tpb4,HiMyNameIsBoard,You're delusional
dd87me0,GearyDigit,"\> /r/altright isn't banned yet""We're mainstream! We're winning!""\> /r/alright gets banned""They're silencing us because they can't fight out logic! We're winning!""Fascism is so predictable."
dd8cl7i,wisdumcube,"Being the loudest or most obnoxious voice on your own little forum doesn't make you the most correct, FYI."
dd8dk14,dumpster_high_dive,That's exactly what we've been telling the liberals.
dd8e0uf,wisdumcube,"Well, aside from the fact that I am not a liberal and the world doesn't exist on a simple x-y axis of political beliefs, ""liberals"" don't think they are right because they are the most loudest, but because they base their beliefs on reality, and get angry at people spreading paranoid delusions as political beliefs."
dd7srz0,JerfFoo,"Creationism isn't allowed to be taught in school, clearly schools have denied creationism a voice because they couldn't logically argue against it. #ShittyAltrightLogicEDIT: My ideology is supported by logic and principles. If all you can do is downvote me to censor me instead of attacking my logic, clearly I must be winning. #MoreShittyAltrightLogic"
dd7ptfc,jereddit,Bullshit you were.
dd8zhn5,HRpuffystuff,Reddit is running their private company the way they want to? FASCISM! Haha good riddance assholes! Fuck off to voat with the rest of them!
dd91kif,dumpster_high_dive,Reddit may run it's company any way they'd like to.Similar to how a people may run their country any way they'd like to.
dd7kk4h,,Shoahed after six million subscribers.What a shame.
dd7lk2t,PerfectingPaine,*6 gorillion
dd7rmfp,PerkyObama,#LITERALLY ANUDDA SHOAH
dd7rflg,TGLea,WTF MUH FREE SPEECH HAS BEEN TAKEN AWAY THIS IS THE END
dd7lxfd,,[removed]
dd8mg0t,,Thank god you're leaving
dd8t9kf,Yellow-5-Son,"We're still here, we'll just also be there as well. Notice how you don't get banned for offering a different viewpoint? You're welcome for the free speech that we provide for you, but of course it's too much to ask for you to do the same for us."
dd94mfe,Aerik,"gee, why do people think you're nazis again?"
dd7kcwg,RedPillDessert,Disgusting. The admins should be ashamed of themselves.Here's their place over at Voat: https://voat.co/v/identitarianI myself mod the (super free speech) Voat sub: https://voat.co/v/AlternativeRight
dd7mswg,dota2nub,"yay, never come back"
dd84cc1,TheTopSnek,Must be fun to be 100% indoctrinated by the liberal media.It's a fact that most if not all Large media outlets are owned mostly by Zionists and Liberals. If all of your information comes from Zionist Left-wing sources you're indoctrinated. FYI.
dd8dvd3,SwigglesBacon,See you later Nazi! Have fun with the ten other people that exist in voat
dd8mnjm,TheTopSnek,"I'm not going to boat, and thinking that it's ok to censor someone just because they oppose your opinion is the most unconstitutional thing possible, you fucking retard"
dd8ob9g,SwigglesBacon,"Fuck off white nationalist, Reddit has no obligation to protect your safe space, get your conspiracy ass back to the hole of your parents basement."
dd8q5vt,TheTopSnek,Says the couch potato
dd8qbdr,,[deleted]
dd937sd,TheTopSnek,Says the couch potato
dd9qjdm,SocialNationalism,Triggered.
dd7y159,pcprincipal69,Sorry you're on the wrong side of history :(
dd7ukfh,,[removed]
dd81t63,,Is that ebonics?
dd85ei0,Saidsker,Is southerner white slang
dd82e27,bunnyhat3,Disgusting shill.
dd7grnv,maxresdefault10,overwrite
dd7gwb2,,The Jew takeover is almost complete.
dd7hwml,polashel,"Not almost, fully. They ban small subs like European, Altright and keep all the idiots in the t_d which was coopted after Trump won. Remember the (((mod shuffle)))? That's when the Jew got in and started banned everyone altright and pushing degeneracy. This shit couldn't be more obvious. ""pepe stands with Israel"""
dd7hzni,,"yeah it's very obvious, but the Jews gotta control the media."
dd7ulhr,,[removed]
dd82b20,bunnyhat3,Waaa waaaa.
dd8jfu7,,Cut and paste buzzword insult.
dd7hjkj,,They already own reddit.
dd7unbr,theivoryserf,It's true. Watch thishttps://youtu.be/8B3cY0HtDQQ?t=2m36s
dd7jevm,Mithrandir_42,"I guess since this is a debate subreddit, why do you guys hate Jews so much? Is it just a joke by now?"
dd7xzk9,pcprincipal69,"There's a ton of things, so I'll just link this and you can read up however much you want.http://www.jewwatch.com/index.htm"
dd7jih3,,Sorry I don't debate bolsheviks. (blocked)
dd7nwhg,Mithrandir_42,Taking the r/the_donald path I see. You guys all give reasonable answers. They... eh...
dd7mtld,Nivagely,"Oh yeah, that'll show them why your ideology is better."
dd7r0z0,DatKidNamedCara,You're all idiots lmao
dd7t7nu,sick__bro,"Damn, sorry you lost your safe space :("
dd7gmxx,,[deleted]
ddb9zmt,baranxlr,👌😩💦
dd7gsij,,http://www.youtube.com/watch?v=1EzJU1Ks9NU&t=0m13s
dd7gt03,youtubefactsbot,">[**Dumb & Dumber: Ok Lloyd, Aspen it is (Crying Scene) [0:31]**](http://youtu.be/1EzJU1Ks9NU)>>Scene from the Jim Carrey Movie Dumb & Dumber (1994)> [*^Jim ^Carrey*](https://www.youtube.com/channel/UCw1E9F9tJW8MXdN3_msiIgw) ^in ^Comedy>*^20,606 ^views ^since ^Feb ^2013*[^bot ^info](/r/youtubefactsbot/wiki/index)"
dd84p1l,,https://www.youtube.com/watch?v=U06jlgpMtQs
dd84p5i,youtubefactsbot,">[**National Anthem of USSR [3:45]**](http://youtu.be/U06jlgpMtQs)>>The mighty anthem of USSR.> [*^rascrifice*](https://www.youtube.com/channel/UCFiVxE2bjLpxmisd_rl9e6g) ^in ^News ^& ^Politics>*^9,585,706 ^views ^since ^May ^2008*[^bot ^info](/r/youtubefactsbot/wiki/index)"
dd7fk45,,"Well, we got a total of about 5 million hits, 16,000 subscribers, and a truly massive amount of people talking about us on reddit. We also got firmly cemented in reddit's history as yet another banned controversial subreddit. We all knew this day would come but I think we did our job in the time we had. We did good for the movement."
dd7fpxr,AltRightEagle,This doesn't come close to ending here.
dd7kren,Feathersofaduck,"On Reddit, it kind of does for a while. Reddit is fairly good about banning copy-cat subs quickly."
dd8mgpg,YopperApe,How long does it take until copycats can be made again?
dd7g0v3,,"Not even remotely. Whenever someone on reddit mentions us, someone will bring up that we got banned. That'll increase both sympathy and curiosity in anyone who was ever even close to becoming redpilled. It's gonna help us grow a lot."
dd7pl7m,ScipioLongstocking,"R/jailbait got banned. People don't have sympathy for pedophiles now. If anything it will prove the alt-right movement was a hateful, racist movement based in the fears of failures who need a bogeyman to blame their problems on."
dd7sfn5,,"You're ignoring that IRL racial tensions grow worse every day. Whites of all political stripes will wake up to the fact that no other racial groups are color blind and do in fact hate them.Like the nice white ladies who went to the Women's March only to have to endure being spat in the face by their ""allies"" of color the entire time. If white genocide wasn't real we would indeed just wither away and disappear. But it is real so we only grow as white people inevitably realizes that all non-whites hate them."
dd8anne,,"> Whites of all political stripes will wake up to the fact that no other racial groups are color blind and do in fact hate them.Gee idk man, I'm white and a few of my friends aren't. Maybe you don't have any non-white friends because you're racist?"
dd8cnsv,wisdumcube,"Racial tensions don't need ideologies based on race to remove those tensions lol. It will just make things worse. Actually, why am I trying to reason with you based on the delusional shit you just said?>If white genocide wasn't real we would indeed just wither away and disappear.Angry confused white people anxious about social and cultural change that don't realize that they are racist are a seemingly never-ending resource."
dd9qmjr,SocialNationalism,> Racial tensions don't need ideologies based on race to remove those tensions lol.Proof?
ddaxplb,wisdumcube,"The basic gist is that the more race is brought up, the more people feel they need to take sides around racial lines and neglect the notion that we are all just humans. Ergo more tensions between groups of people. The only endgame is racial purity which means complete racial genocide or total isolation between cultures and ethnicities. So maybe you can have peace after everyone, except those who thinks like you, are dead or completely isolated from you, which probably means the opposite and you will find yourself in isolation from everyone else who isn't paranoid about other races."
ddb2i1l,SocialNationalism,"That's a word salad, not proof."
dd8ymsb,winstonsmithwatson,"I've been taught to respect my elders and behaveEven if when they were young they sold slavesTruth and understandin' is what I craveIn the land of the thief, home of the slaveTurn your page to a brief demonstrationCos now in '90 it's strictly information I'm givin'Teachin' on a regular basisToday's lecture is about The RacistWe're not out to exaggerate or diss himBut show the symptoms and facts of racismUnderstand The Racist ain't equalThere's about five different types of racist peopleFirst of the five different types of casesIs the individual brought up racistHere you have young men and womenBrought up in the Great White Way opinionThis opinion introduced by the parentTo the civilised becomes transparentThe civilised man could look through the facesMake the analysis and see The RacistNumber two case which y'all must hearIs the individual racist out of fearHere you have people that fear the AfricanAnd conjure up new ways of trappin' himNumber three is the unconscious racistNot knowin' they're racist they invade your spacesThey say, ""I'm not a racist, I'm not a bigot""Yet they allow it to go on and won't admit itNumber four is the money racistThe one that used the topics of sheer economicsThey say, ""Owning a business isn't for the black manHe don't want that"", yet they went and took his landDamn, that's like a rock in a hard placeYou don't have your land yet this ain't your spaceAmerica was built by every other raceExcept the European that runs this placeWhat a waste, America's doomedTo be overthrown by the righteous real soonBut last but not least racial prejudiceIs the black man speakin' out of ignoranceWhitey this and Ching-Chow thatIs not how the intelligent man actsYou can't blame the whole white raceFor slavery, cos this ain't the caseA large sum of white people died with blackTryin' hard to fight racial attacksThe media wants you to think that no whitesReally fought and died for Civil RightsBut once we have a true sense of historyYou'll see this too as a mystery**If black and white didn't argue the most****They could clearly see the government's screwin' 'em both**"
dd7j4ld,Justanotherfashygoy,We really need a new subreddit. I wouldn't have been red pilled without this place. The numbers were growing so fast.
dd7oeg6,Desay,"Yeah a big part of me wants to say fuck this place because it's another SJW center, but on the other hand, we really do need a presence.You can cut one of us but two appear, crybabies. Ideas don't die and your control is on borrowed time."
dd7v260,theivoryserf,Yours died in 1945. You're nothing but a trapped rigor-mortis fart in the wind.
dd7iyqf,VictoriaSwann,More likely it will be used against us. I've frequently seen Twitter bans cited by liberals or the media as if they were criminal convictions.
dd7ux0i,,"Sure, in the same way that Fat People Hate is so frequently mentioned now. Most of us regard it as a fad whose participation was driven largely by contrarianism and the need to dissent against the perceived tyranny of Ellen Pao.Nobody really likes fat people, but I don't see any real interest in reviving the subject of a subreddit around it."
dd7jbfu,,"> Well, we got a total of about 5 million hits, 16,000 subscribers, and a truly massive amount of people talking about us on reddit. We also got firmly cemented in reddit's history as yet another banned controversial subreddit. We all knew this day would come but I think we did our job in the time we had. We did good for the movement.Time to make another."
dd7pk7n,0mac,"New subs and you will find the ban hammer for ban evasion. So, carry on."
dd7q5zj,,Then why did r/AR exist if it was essentially coontown/European 2.0?
dd7qbol,0mac,"I don't know. Did they have the same mods and start out as a reaction to the banning of those subs, claiming to be a continuation of defunct ones?"
dd7r4ab,,"Maybe, maybe not. I'm just saying I think it'd be useful to keep annoying them until *they* give up. You either lose a battle of attrition due to your own lack of will or the enemy actually succeeds at taking you to the last man."
dd7n2z6,notoyrobots,"> We did good for the movement.Just to be clear, your movement is Nazism. You did good for Nazi's. Great job."
dd7pq1h,,"Wrong. Not all of us are National Socialists (which is the actual, non-pejorative term)."
dd8cp9k,notoyrobots,"No, I meant to use the perjorative, you idiots are fucking retarded. And fucking Nazi's."
dd8z96d,Sedorner,"Oh, my sides. Does being called a Nazi hurt your feelings?"
dd7urib,ProllyJustWantsKarma,"Nazis don't deserve a non-pejorative term, and nobody gives a fuck about what Nazis prefer to be called."
dd7lsfp,cristi1990an,>16000 subscribersYet no post on that sub ever reached over 300 upvotes... K
dd8if3w,PurpleTorture,"> We also got firmly cemented in reddit's history as yet another banned controversial subredditWow what an accomplishment. You got banned from reddit. I am sure they will write that in the history books. Like in a thousand years from now people will be sitting around the dinner table and say ""Hey remember that time /r/altright got banned from reddit?"" and their loved ones will respond ""What the fuck are you talking about?"""
dd84o66,,https://www.youtube.com/watch?v=U06jlgpMtQs
dd84ojm,youtubefactsbot,">[**National Anthem of USSR [3:45]**](http://youtu.be/U06jlgpMtQs)>>The mighty anthem of USSR.> [*^rascrifice*](https://www.youtube.com/channel/UCFiVxE2bjLpxmisd_rl9e6g) ^in ^News ^& ^Politics>*^9,585,706 ^views ^since ^May ^2008*[^bot ^info](/r/youtubefactsbot/wiki/index)"
dd86i60,AnExoticLlama,"Nah, y'all can fuck right off."
dd7muwa,Bart_Thievescant,"Good. Fuck Nazis.Yes, You're Nazis."
dd7mvts,,I don't debate Bolsheviks. (blocked)
dd7vx6x,tonyp2121,"Why? Afraid to find out your wrong? Or are ""bolsheviks"" not worth debating for some other reason."
dd82cyw,bunnyhat3,You're*.
dd84zgr,tonyp2121,You really addressed my point great job
dd864jt,,I don't debate Bolsheviks. (block user)
dd8c8kz,Hankyman,"I'm not a bolshy, I just hate Nazis. For someone who claims ""God these bolsheviks can't debate"" you're not so good at it yourself."
dd9qsfq,SocialNationalism,"Fuck Bolsheviks.Yes, you're a Bolshevik."
dd935y7,Snorhax,But what about our free speech? Why should we be giving Nazis a platform when they don't afford you the same courtesy?
dd871bt,AustinAuranymph,dafuq even is a bolshevik
dd89i3e,Apotheosis276,serious?
dd89klu,AustinAuranymph,"Yeah, I live in the 21st century. I don't use obscure antiquated terms just to sound smart."
dd9akm7,Apotheosis276,"It's not obscure at all, wtf? Every educated person is taught about them. Use of ""Bolshevik"" is just as antiquated as ""Nazi,"" that's the point."
dd8kzme,,Seems you just don't know history imo
dd8l5ev,AustinAuranymph,I looked it up and I don't see how hating Nazis makes you a Communist. Hating Nazis just makes you a sensible person. I hate Nazis. I also hate Communists. What does that make me?
dd8n207,,"It is a pretty dated term. Tye point being was bolsheviks violently overthrow and censor opposing opposing opinions.Ironically the bolsheviks controlled by jews won over the nazis. So its similar to this, just on a smaller scale.Undeniable truth does not fear opposing opinions. Considering we're not the violent ones."
dd8nen8,AustinAuranymph,"So, if someone was screaming anti-vaxxing propaganda, would you not want them to shut up? Vaccines are clearly effective and safe, so why would they fear anti-vaxxers?Maybe, it's because the things that anti-vaxxers are saying can do serious damage to society, despite not being true. If they convince enough stupid people to believe them, people will die from diseases that have been long gone until now. Children will die from preventable disease and plagues will return, potentially wiping out millions of lives.So, even though vaccines being safe is undeniable truth, it still needs to fight against opposing opinions. Because some people will be tricked into believing lies. It's the same with the Alt-Right."
dd8o0zh,,"Right and I see where you're coming from as that makes perfect sense. Same with antifa attacking people for their beliefs. The alt-right is a pretty lose movement of autists, educated, and normal people. But its morally incorrect, not untrue for the most part.The main purpose of the alt right is to create ethnostates and having people understand race realism. Alt-right was conceived defensively among whites that understand multiculturalism and mass migration affects only them negatively in the way that they are being demographically eliminated from their own nations. This also in the process destroys the various cultures and societies associated with the individual races that could be considered white.Because many alt-righters agree that western society created by whites is the best place to live on the planet. It gives reason for some to believe in white supremacy or a wanting to keep whites a majority and in power in their native homelands.See where I'm getting at?"
dd8odw0,AustinAuranymph,"America is not the native homeland of white people. If they are so concerned about native homelands, they should go back to Europe.They didn't seem concerned about mass migration and and cultures being destroyed when they demographically eliminated the Native Americans who once called this place home.They didn't care about native homelands when they dragged Africans away from their homeland and over to America, to provide us with slave labor. They didn't care about racial identity when they forced them to speak English, and adopt American names, and American culture.The Alt-Right should just admit what the really want. To be on top of the world, and have every other race licking their boots."
dd8pyod,,"Well, you are somewhat wrong. I'll try to elaborate on a few things you simply haven't really been taught about, or maybe gave any real thought.For one, america was indeed founded by whites, for whites. See the naturalization act of 1790. The native americans were a loose collection of warring and feral tribes with no written language, society or any sort of advanced society.The success of this country can clearly be attributed to the europeans that founded and created this country, which stayed over 90% white up until around 1965 when the civil rights act was made by kennedy. Again, whats morally incorrect does not invalidate what I've just said. Also lets move on to the topic of slavery. Not saying this condones what has happened, but let me clear up a few things. First off, whites did not rip africans out of africa themselves. The african warlords sold europeans slaves, their own people to them. The vast majority of slaves sent out of africa in the slave trade in fact went to south america and the middle east. It is wrong to portray whites as those who created slavery. Arabs for centuries before even the crusades had been enslaving people even whites from captured christian nations of the kiddle easter, north africa, spain and southern europe. Europe was the first place to formally ban slavery, america soon followed, and white people fought war amongst themselves to end slavery.Next onto european colonization, putting aside why european society was so much more advanced and able to just take over the whole african continent without much issue. European colonization overall helped a lot of areas of africa move out of the tribal state and into atleast the semblance of a developing nation.With europeans pretty much gone, they have roads, hospitals, infrastructure. They may not be capable of actually using them as efficiently as europe, america, or asia. But they would not have made them without europeans being there.Lastly africans and native americans had no written language or practical language, hence why nobody speaks it globally. If they truly did not like us find us oppressive and hateful we wouldnt have the most equal, prosperous and humane countries on the planet that every third worlder and their brother wants to move to. Again, while mother nature and history look kindly on us relative to all other nations and races, does not mean we as whole desire to have everyone lick our boots. Like I said, we wish for ethnostates to preserve our people and culture that is gradually being destroyed via demographic elimination. That is one thing that you can recognize whether you agree or not, is happening."
dd8vxra,AustinAuranymph,"But why not return to Europe? America still isn't your ancestral homeland. And Native Americans are not warring tribes anymore. They could run things just fine. And yes, I know white people didn't kidnap black people from Africa, but they did choose to buy them. They could have denounced the idea of slavery and chose not to buy them, buy they didn't. Shouldn't America be a Native American ethnostate, and Europe be a white ethnostate? It just makes sense, according to the Alt-Right ideology."
dd8w9fy,,"Right I agree with that. But if we are being more realistic, dissolving the USA and completely abandoning it is not really a possibility. Rather we redraw the lines of nations, and create ethnostates. Some countries giving and receiving land to certain peoples would have to be the way to go about it. Atleast that how I wish things would go. But they wont."
dd7tluz,threatbyexample,Cuck
