Comment ID,Username,Comment
dd7ynpw,,"Why would I be questioning your sexuality? I'm not. **I'm pointing out that you're a submissive queer with a military uniform fetish**.> I bet you're one of those guys who thinks rubbing your nuts on someone is macho.Well, then I'd be careful how I fucking talk me or else my nuts might indeed end up on your face."
dd7z0fj,Sithsaber,How is making fun of Rohm's ilk a fetishization of those like him? Nobody likes gullible morons. And what's with the tough guy shit? We're online and I'm not your frat brother. It's silly to posture over who'd castrate who.
dd81kff,,"Dude, I get you're gay for me because I'm a Nazi. But please just fuck off, I'm not interested."
dd826ux,Sithsaber,You really shouldn't be proud of being a fool.
dd80v3q,seemefly1,is that your attempt to recruit more Nazis?
dd81qt5,,We're not letting you join. Sorry.
dd81vso,seemefly1,"aww man, I feel so left out and isolated...you sure?"
dd7wizu,,"Oh yeah, and downvote."
dd7p2qc,_Decimation,[It looks like even they're pissed that it was banned. You sure it was them?](https://www.reddit.com/r/The_Donald/comments/5riert/raltright_banned_even_if_you_dont_agree/)
dd7pqod,,Maybe the subscribers themselves can be pissed. But (((mods))) are probably glad we got shoah'd even if they didn't have anything to do with it.
dd7uuut,Trumpologist,yeah this wasn't us
dd7jbvv,Mithrandir_42,r/the_donald is not the same as r/altright. The alt right actually make sense in their arguments in a way that even a leftist like me can respect.
dd84jpa,TotesMessenger,"I'm a bot, *bleep*, *bloop*. Someone has linked to this thread from another place on reddit:- [/r/asablackman] [Asa leftist, \/r\/altright's arguments make sense and are respectable](https://np.reddit.com/r/AsABlackMan/comments/5rl4ab/asa_leftist_raltrights_arguments_make_sense_and/)- [/r/iamnotracistbut] [\[\/r\/debatealtright\] I am a leftist but \/r\/altright's arguments make sense and are respectable.](https://np.reddit.com/r/Iamnotracistbut/comments/5rl45w/rdebatealtright_i_am_a_leftist_but_raltrights/)[](#footer)*^(If you follow any of the above links, please respect the rules of reddit and don't vote in the other threads.) ^\([Info](/r/TotesMessenger) ^/ ^[Contact](/message/compose?to=/r/TotesMessenger))*[](#bot)"
dd7kmkj,Gandolf1996,"I've only seen nothing but scientific racism in that place, what arguements are you talking about?"
dd7l72k,,"And that's the point: t_d does not condone racism. This ""betrayal"" makes plenty of sense."
dd7o2k3,,"Got banned there today for questioning the Sessions appointment just because he had previously been anti-marijuana which I disagree with.>/r/The_Donald has become an absolutely power-hungry cuck fest with autistic mods who are clearly anti-altright and pro-multikulti. They can get fucked. They are traitors to everything they once stood for, and are now just there to ""trigger snowflakes"" which they are slowly becoming themselves.Stolen from one of the other alt right subs talking about the ban. Its hilarious they are turning on each other."
dd7sigi,Milmanda,I don't get how TD can be pro-multikulti. Isn't that why they were attacking /r/Sweden all those months ago?
dd7vhvs,bodymessage,Retards gonna retard
dd80f8s,wont_tell_i_refuse,">all those months agoKey phrasing. The culture at T_D has changed. Watch in the coming months, they'll try to distance themselves from the alt-right."
dd7x9sg,slightlysubversive,More like expected.
dd7kyhv,,[deleted]
dd7nt64,Mithrandir_42,Explain
dd7oday,KEKthe1trueGOD,https://twitter.com/breddy_gud/status/800941522594267140
dd7kiag,bannedagainbro,"Similar to what South Africa did to Rhodesia. Also similar, the ethics of t_d was always trash compared to altright. No dissent, boundless circlejerk, etc."
dd7l1eo,,Can you expand on that South Africa point? I always thought that they were their only allies and trading partners after Britain and America abandoned and undermined them?
dd7lyyg,bannedagainbro,According to Ian Smith's memoirs (premier of Rhodesia 1964-1979) the reason Rhodesia had to surrender was that the South Africans stopped their support due to western pressure.
dd7m8kl,-Reactionary_Vizier-,"Vorster co-operated with USA pressure and reduced his support for Rhodesia, in return for more time for the South African Afrikaner state."
dd7lhih,,[deleted]
dd7ls0g,bannedagainbro,"I'm doing what's called an allegory. That's one of those scary situations where one shouldn't take things literally. Also, seeing as you're leftist scum, perhaps a minority, I think you're misunderstanding what I'm saying (due to your lack of knowledge about African history). South Africa betrayed the white nationalist government in Rhodesia to appease the anti-colonial politicians in the west."
dd7n8kt,razzthesummoner,>I'm doing what's called an allegory. No you're not. That's not even remotely an allegory.
dd7neb1,bannedagainbro,"Strong argument. > Merriam-Webster:>Definition of allegory>1: the expression by means of symbolic fictional figures and actions of truths or generalizations about human existence <a writer known for his use of allegory>; also : an instance (as in a story or painting) of such expression <The poem is an allegory of love and jealousy.>>2: a symbolic representationRegardless, it's a semantic argument and doesn't affect the content of the argument."
dd80vcm,EricSanderson,"You need to stop talking for a while. Neither of the things you compared is fictional, which is the minimum requisite for an allegory. It's right there in the definition you linked while trying to prove you were right. I think you mean an analogy? Most of us learned them in the third grade. Example: ""Alt-righters are to reality as penguins are to the Sahara desert.""And etymological refers to the origin of words. I have no fucking clue what you were going for there. Semantic maybe? Christ just stop talking."
dd8ca7y,bannedagainbro,"I actually meant semantic yeah. I was just tired when writing that. > Neither of the things you compared is fictional, which is the minimum requisite for an allegory.Not in the second definition according to Merriam-Webster, no. > Most of us learned them in the third grade.In the third grade I hadn't even learned English yet. But congratulations on having a hysterical meltdown of self-righteousness over someone speaking his third language having minor trouble over semantics."
dd8dde1,EricSanderson,"No one is forcing you to use ten dollar words you don't understand. You're trying to show /r/iamverysmart and failing; don't get all pissy when you get called out for it. And I'm guessing you don't know what hysterical means either, because I'm quite calm. You actually made me laugh a few times."
dd8dt5p,bannedagainbro,"Given the fact that you haven't at any point addressed the content of the argument but instead irrelevant semantics, I'd say you're the pissy one. Have you even stopped to think that my first language doesn't have a similar distinction between words? How much do you even understand about language?"
dd8e21y,EricSanderson,I understand that I shouldn't use a word if I don't really know what it means. I also understand that using big words doesn't make me any smarter or make my argument any more valid. I don't care how many languages you can speak. All I'm saying is maybe hold off on all the affectation until you have a better grasp of English.
dd8ei3y,bannedagainbro,"1. I know what etymology and semantics mean. I made a mistake because I was tired. 2. My usage of allegory was not wrong, it was within the definition within Merriam-Webster. 3. These are not ""big words"". 4. Making minor language errors does not invalidate the content of an argument."
dd8g380,EricSanderson,"An allegory is a symbolic comparison, like Aesop's Fables or Animal Farm. You were comparing two real things, which is just a comparison or an analogy. There was nothing symbolic about it. I'm sure you were just ""tired."" Or maybe you weren't wrong at all, you were just using alternative grammar. If they're not big words then how is someone as smart as you having so much trouble with them? It's amazing to me how far you're willing to go and how long you're willing to argue just to avoid admitting you used a word you didn't understand. But I'm done playing into it. Have a good one"
dd8hcbg,bannedagainbro,"> There was nothing symbolic about it.A symbol is just a representation. There's no requirement of irreality or reality. >If they're not big words then how is someone as smart as you having so much trouble with them?I'm not having ""so much trouble"" with them. As for the reasons, I've already given them. 1. I was tired. 2. English is my third language. > admitting you used a word you didn't understandI understood the word, and used it in accordance with its dictionary definition."
dd7ogbz,fklife53,I seriously doubt this subhuman even knows what etymological means... thankfully Trump used simple words so that it could process that which was communicated.
dd7vvwp,OyGevaltGoyRevolt,"/u/bannedagainbro used the word correctly, you're just insulting him for no reason which makes you look stupid."
dd80y2h,EricSanderson,"Please, explain how he was correct."
dd7w2d2,smonke,Pretty sure you're the one who doesn't know what it means if you think he used it correctly
dd7p7l3,razzthesummoner,Seek help.
dd7tak0,SwanBridge,"Historically speaking Afrikaners and British Africans have no love for each. Southern Rhodesia was complicit in the subjugation of the the Transvaal and the Orange Free State, and remained far closer to the United Kingdom than South Africa did following 1948. For the most part Rhodesia was only a partner of convenience for South Africa and vice versa. Despite a Westminster political system, and the dominance of the white minority they were politically quite different. At the top level there was no sense of brotherhood of 'white nationalism' between the two, so it was not a betrayal, it was realpolitik. Vorster's withdrawal of support to Rhodesia was more based on Kissinger essentially threatening to collapse the South African economy, and for the country to meet a similar fate as Rhodesia, a real threat considering the erupting riots in Soweto, when the two met in West Germany prior to the Geneva Conference. Call it appeasement, but he did so in his national interest."
dd82g5z,Mundane_Batrachian,How about comparing it to what's happening in every White nation today?
dd7p42v,,"holy shit, how far up your own ass do you have to be to make *that* retarded analogy? lol"
dd7lnhi,Tim_Theory,Got a source for that?
dd7wp84,SirFappleton,That sources name?My feels
dd7ho6d,dumpster_high_dive,....are you fucking seriousI knew they were cucked but still an ally in these trying times. They truly believe they have last as little on common with us as the SJW pozzed lefty commie scum.Fucking traitors.
dd7hrpf,JumbledFun,are you surprised? They worship milo like a god and we all know what color dicks he's sucking
dd7huh8,dumpster_high_dive,"No, not surprised. Just, disappointed..."
dd7ihqm,JumbledFun,watch those duplicitous fucks with no morals use this as a way to complain about reddit censorship like they are the fucking victims here
dd7o3fo,Cypherrpunk,"fuuuuck, I knew I should of taken screenshots from centipede central. some of the mods were bragging and joking about it a while back but didn't think anything would come out of it."
dd7o3h6,could-of-bot,"It's either should **HAVE** or should**'VE**, but never should **OF**. See [Grammar Errors](http://www.grammarerrors.com/grammar/could-of-would-of-should-of/) for more information."
dd7ih6j,pcprincipal69,They also have some Israeli mods. Wouldn't be surprised if they were the ones complaining.
dd7n1ik,geekygirl23,"Ooh, ooh, what color dicks? Let me guess, it's a shade that isn't lily white?"
dd7ndc4,JumbledFun,The color filthy cuck libs love sucking
dd7nk0g,geekygirl23,Same color dicks you secretly want to play with yourself?
dd7nqi0,Desay,"Typical SJW level of wit, humor, and insight. Unintelligent targets tend to be the most amenable to societal programming."
dd7oavr,farazormal,"It was a come back to ""libs suck black dick"" you really don't have a leg to stand on here."
dd7okwx,Desay,"Which was a retort to her original, uninteresting reply. Which she then replied to in the least clever way possible. Just pointing out their insults are stupid and incredibly predictable, every single time pretty much, because they are emotionally deficient children, and that's what they do, use the same stupid unclever...ah fuck do I care."
dd7uymh,ARandomDickweasel,"Jesus H Christ on a stick, you are a dumb fuck. I honestly haven't seen that much dumbfuckery crammed into a post that short in a long time. Congrats!"
dd7nyi9,geekygirl23,I have a solidly anti retard agenda. Didn't know SJW's talked like that huh?
dd7o7hk,Desay,"I know exactly how you talk and what predictable things you will proudly trot out like you aren't the ten thousandth person to make the same joke. Look, the person above replying to me linked to r/iamverysmart. Truly clever."
dd7ohto,geekygirl23,"In all of my years I have never met a single person that was vehemently opposed to something that they didn't secretly partake in / lust about. Except for Bob. We know you're gay Bob, stop trying to hide it."
dd7ow96,Desay,"Not even remotely true. Everyone here is what, a Jew fetishist?It might be true of yourself and other emotionally driven, intellectually stunted individuals, but adults are able to decide the benefits and drawbacks of things based on actual analysis.Like I said, I know how you children think. ""Haha that guy doesn't like black people he most love black DICK aahahaha."" You think that because, like I said before, you rely on what you're told to believe as opposed to what is intuitively true. Liberal ideology has been pushing this idea for a while now. Just look at the misnomer 'homoPHOBIA' which inherently implies this and which every braindead liberal will quickly parrot out 'haha people who don't like gays are gay' even though only 4% of the population is gay and it's perfectly reasonable for adults to come up with personal reasons for disliking things that have nothing to do with suppressed lust."
dd7pdjc,edessasail,Why are you arguing with sluts that post nudes on reddit who are obviously trolling?
dd7pv1b,Desay,I don't know. Just bummed out man. Glad I'm not as fucked up as her though. What a surprise a person with a bizarre litany of personal issues is a textbook SJW.
dd7q28v,edessasail,There'll be another sub made eventually. The same thing happened to /r/coontown.
dd81dkd,TheRealTayler,"Yay, the ""Christian"" has arrived. We're done here."
dd81mwx,edessasail,"I've been on this sub since it was made, but okay. And no need to try and pretend being an ethno-nationalist is an affront to my Christianity. Mexico is a Catholic country with ethno-nationalist immigration policies that are explicit about maintaining the country as a mestizo one. St. Thomas Aquinas defended the notion of loving those more closely related to you genetically in his Summa Theologiae."
dd823y5,TheRealTayler,Doesn't the bible say love thy neighbor as thyself? Or do we get to just pick and choose certain parts of the bible and ignore the rest?
dd82g6a,edessasail,">Doesn't the bible say love thy neighbor as thyself?It does say that. It wouldn't be very loving of me to dispossess my people of their country, and reduce them to a hated minority group within it while upsetting the common good of the society by attempting to force something as harmful as diversity upon it thereby annihilating all social cohesion. The Maccabean's brutal insurrection to force the Greek pagans out of their homeland is also in the bible, and the Maccabees are blessed by God in their struggles. Israel is created as an ethno-state on God's own command. If ethno-nationalism were an intrinsic evil God wouldn't have created an ethno-state in the kingdom of Israel. Perhaps you should stop pretending you actually care about the bible or understand anything within it since you seem to think some secular conception of tolerance is the same thing as the divine *agape* of Christian thought.>do we get to just pick and choose certain parts of the bible and ignore the rest?You tell me since you seem to be ignoring this verse from St. Paul's first letter to Timothy.""If anyone does not provide for **his own**, and especially *his own household*, he has denied the faith and is **worse than an unbeliever.""**Not to mention the bible isn't the sum total of Catholic doctrinal authority, and your private interpretation of the bible is hardly magisterial.Edit: Also the ""love your neighbor as your self"" is a precept of individual conduct, not a statement of political policy. The duties of the state are in no way the same as the duties of an individual."
dd7o027,CloudCollapse,/r/iamverysmart
dd7ow65,Desay,"Another witty, original reply. I guess you proved me wrong."
dd7p8mp,CloudCollapse,Hey man show me some of this wit that you wanna see us use so I have a reference.
dd8x67s,nwz123,did you just attack the level of discourse RIGHT AFTER and BEFORE your 'comrades' made the exact same level of stupid 'unintelligent' humor?Wow you are insane.
dd9nwu2,Desay,"That 'comrade' was a literal SJW infiltrator who I have tagged, so, yeah."
dd7z5cx,Yellow-5-Son,"This guy is a liberal troll planting false flags. Do not believe him, read his comment history for proof."
dd7ss0f,VoltageSpike,What exact color would that be? I'm genuinely curious.
dd7vdnm,ObamaBeenGauzy,I'm thinking rainbow
dd7lz8y,,[removed]
dd7p24d,ScipioLongstocking,"I've also noticed a large influx of fat, white girls on my college campus. Maybe that is where all the BBC love is coming from."
dd7xtvw,NostalgiaNovacane,"dont think ive ever been with a girl with a gut, but I guess if everyones getting fatter that means slim pickings for you guys for whatevers left over"
dd7r02l,Desay,Patently untrue. Even leftist white girls despite what they say won't date black guys for the most part.
dd80je7,TheSugarplumpFairy,"Leftist white girl here, I definitely date black guys. So would all of my friends (and most have). But you keep thinking that! We definitely would never date racists nazis, though. Sorry, pal!"
dd8jst8,Desay,"You're fat, aren't you? ""Sugarplumpfairy"" + ""leftist white girl""...Either way, your anecdotes are great but I'm basing this off hard data and wide opinion surveys."
dd7xshh,NostalgiaNovacane,you sure? because my life as a black college athlete says otherwise. girls sometimes literally tell me thats the only reason they hookup with me
dd8jv08,Desay,"Yeah, I am, most girls are unwilling. I never said all. There's probably a large enough subsection that you personally may not see it but the percentage who have ever entered into such relationships are very small. That's why I say they can talk all day but the data doesn't support it."
dd8k0v1,NostalgiaNovacane,Relationships? Lol I don't think you know what hookups/FWBs are but that's okay.
dd8karm,Desay,"That's a form of relationship, a relationship being a correspondence between two people. The point is the vast majority of white girls across the population as a whole have never had any sort of such interracial relationship. You might need to look beyond your anecdotal data here. Black people are 13% of the country and whites 65%, the numbers alone make it unlikely much less the various other factors which come into play."
dd8kesu,NostalgiaNovacane,It's fun traviling across the country sleeping with girls along the way. Something tells me girls are no where near as egar to be with you.
dd8ksr1,Desay,I've fucked black girls. I can see why you want to dip outside. Just remember you're only getting the self hating and pozzed ones. I'm sure you can find them in every city. Keep digging those scraps.
dd8l6yg,NostalgiaNovacane,If that makes you feel better lol. I have no problem smashing instagram whores and 8s-10s daily. Not trying to wife or date anyone. Goodbye and enjoy your not so frequent sex.
dd9o3q9,Desay,"Hey Tyrone>Here's another way to think of it. If the average self-identified black is 73.2% black and the average self-identified white is 0.19% black, then the average black in America is 385 times blacker than the average white. That doesn't seem very murky to me.>There are about 200 million whites, so that means a little over 3% have any black ancestry that can be found by 23andMe. Saw this and thought of you. Not a lot of mixing been going on after all. Most of it watering down blacks not the other way around. Keep smashing those fatties though maybe you'll make it up."
dd9o7qf,NostalgiaNovacane,"Never been with a girl with a gut but I'll let you know if it ever happens. Women college athletes and sorority girls are usually in shape ;) Again, what makes you think I'm having kids and wifing these girls lol? That's your job after I'm done with them"
dd7si4a,Angryhippo2910,TIL The British Broadcasting Company gets the ladies wet.
dd7m7ta,tridentgum,"How deep does this ""cuck"" shit go, lol."
dd7lva7,Yellow-5-Son,"/u/JumbledFun is a liberal infiltrator, read his comment history."
dd7ra8f,Desay,"Yep, I have him tagged."
dd7m7xp,Literally_A_Shill,"The mods of The_Donald have a long history of doxxing, threatening, blackmailing and harassing each other for control of the sub."
dd7oby1,Sifr_Brude,Got a source for that?
dd7oexd,JumbledFun,look at all you cucks from the_jewGrandpa streaming in trying to play coy like you fucks actually care about this country and it's future
dd7ucs6,theivoryserf,Some of our relatives died to wipe Nazism off the planet.
dd7phsn,apathetictransience,trollers gonna troll
dd7hiaj,,[deleted]
dd7lul3,Yellow-5-Son,"/u/JumbledFun is a liberal infiltrator, read his comment history."
dd7nllo,Seph_Bogel,You should NOT be being downvoted for this. Their top-rated post is on /r/AgainstTrumpSpam.They haven't even provided any evidence. They should not be taken seriously.
dd7qylp,AnindoorcatBot,I caught /u/thats_bone & /u/ash-aku doing the same shit yesterday
dd7rbuv,thats_bone,Caught me doing what exactly? I feel like this is going to be disgusting.
dd7ryxu,AnindoorcatBot,nothing.
dd7sdqy,thats_bone,I didn't think so.
dd7t68x,AnindoorcatBot,go away racist. back to your nazi loot camp.
dd7ypx6,blobbyghast,"This guy is right, JumbledFun is an infiltrator. Please don't blindly trust people posting divisive comments just because they use terminology like ""cucks""!"
dd7hp7r,JumbledFun,"seems like it. Altright were just a source of votes and a nice scapegoat to push negative press on, they don't actually care or agree with the movement, just a tool to them"
dd7uyms,Kingca,"Well, you're a nazi. Did you expect to win? Punching nazis is a time-honored American tradition."
dd84byr,,I don't believe anything that the average young American infantryman in WWII didn't believe. Stop trying to inherit their legacy when you betray the nation they built.
dd84l1v,Kingca,That is absolutely what they believed. They beautiful squeal of a nazi dying at the hands of a Jew.umad we won?
dd84xeh,,"I am not a National Socialist. Hitler was a warmonger, and brought Europe to ruins. He was overly cruel to the Jews and slaughtered the Slavic peoples in huge numbers. He had to be stopped. I recommend that you actually speak to some WWII veterans to learn their actual opinions on race. They fought for an almost entirely white nation, not the erasure of their race that is occurring."
dd853n7,Kingca,"What the hell are you blabbering on about? Americans did not fight for an entirely white nation. And there is no erasure of white people in the US. You're literally insane, and you might be a nazi."
dd85g20,,[The nation was 87% white then.](https://thesocietypages.org/socimages/files/2013/05/Screen-Shot-2013-05-07-at-7.33.46-PM.png) The European population is declining in the US.
dd85sxu,Kingca,"Did you really just link to white nationalist *propaganda*? Okay, okay. I see what's going on here. I thought I was about to engage in a legitimate conversation, you actually had me interested for a second.Carry on, nazi. And pray that those who know you irl never find out you're a nazi."
dd864nc,,"[Is wikipedia good enough for you?](https://en.wikipedia.org/wiki/Historical_racial_and_ethnic_demographics_of_the_United_States#Historical_data_for_all_races_and_for_Hispanic_origin_.281610.E2.80.932010.29) I'm pretty open about my views, as I keep close company and I can argue for them."
dd8695v,Kingca,"Your own link proves whites are not on the decline.Look, I don't care about this enough to continue arguing with a nazi. And it's not even disappointing in the least that other races are gaining more representation. That's a very good thing.Go draw swastikas under your desk, or whatever it is you do in high school."
dd86ghd,,How are whites not in decline? We will soon be a minority in our own country. Every projection shows this. Multicultural nations are less successful.
dd86ie0,Kingca,"> our own countryI'm sorry, *whose* own country?"
dd86n8x,,"America was founded by whites, for whites. The Founders made this clear in the Naturalization Act of 1790. They never intended it to be a non-white multicultural nation. Natives also have a right to live here, but they did not establish the nation."
dd86p46,Kingca,"Disregarding how factually inaccurate your description was... it hasn't been a nation for whites in a long, long time. And good fucking riddance."
dd86tjs,,"Nothing I said was factually incorrect. It use to be a nation for whites until the Immigration Act of 1965, which removed the requirement for national quotas."
