Comment ID,Username,Comment
dd9yj5q,gerbaire,"You know what's going to kill off the white race? Anthropogenic global warming. It's happening way more quickly than anyone could have ever anticipated. There is undisputed evidence proving it, it is not a matter of debate in the scientific community, and you can't deny it since you like the word fact so much. That would simply undermine the very definition of the word fact. Not only will we all die when the planet Marsifies but these brown people you are so scared of will come to western countries by the billions as fresh water runs out and the tropics become more and more inhospitable. It's already happening. Just look at the Israeli-Palestine conflict. It's mostly about fresh water now. Global warming, dude. That should be your worry. None of this racist propaganda based on some idiot's gut feeling you like to spread."
dd8ap0y,,lmao
dd8amde,,No you don't. You want the death of the white race because you're MGTOW.
dd8ar14,FalloutFan2,Wrong. Just because I'm MGTOW now doesn't mean I would be MGTOW under ideal circumstances.What do you think about the shutting down of /r/altright?
dd8b4m4,,"It was inevitable. And yeah, you are. You would be then as well. AWALT, remember? It's truth, or are you conveniently holding more than one truth as true?There was no way that the reddit admins were going to let it stay around with all the traffic going on and with tonight's most recent antifa riot. /u/spez is in on it, just as much as Ellen Pao (/u/ekjp) was, and it will continue to happen to any and all communities they don't agree with.And AGAIN:You would be MGTOW under ideal circumstances, because there is nothing else. Women have always been ruined, will always be ruined and nothing can ever fix any of it. Even a hard reset will just result in mass death and nobody learning anything.**There is No Future but Nuclear Fire.**"
dd8b7mc,,[removed]
dd8bbvb,,"> Yes, AWALT, but that doesn't mean I'd have to actually interact with my wife other than for general familial things. And you think that wouldn't lead to the inevitable decline in family life and divorce? You're sadly deluded if you think that it would work out in any other way.>The main thing is that she wouldn't screw me over in potential divorce. That's always been the main thing about MGTOW.Until you carry the idea to it's logical terminus. **You don't get it and I don't think you ever will.** You would still have the potential for divorce, in an ethnostate women would still be unbearable and would still work against you even if they couldn't officially. You'd just end up framed for something you didn't do and your marriage annulled that way rather than just no-fault divorce.**You know not where you are, nor the conditions in which you live. Yet you expect to be able to dispense advice, guide others to spirituality and establish goals?**No. Never. **There is No Future but Nuclear Fire.**>Yeah, it's annoying because I had a lot of posts saved from that sub that I can never access again. Should have back them up somehow bleh.I don't see why they didn't ban the fuck out of you for being MGTOW other than the fact that they hated me more than you. But, that's the case for everyone. I've always been hated by everyone, I will always be hated by everyone. Because nobody wants to admit that all of life is misery and nothing can ever improve.You should have known better. If FPH and Pizzagate couldn't stand, then why would Alt Right be able to? If CoonTown was banned, why shouldn't everywhere be banned?**SRS controls this site and has /u/spez by his non-existant balls.**"
dd8bjua,FalloutFan2,"> And you think that wouldn't lead to the inevitable decline in family life and divorce? You're sadly deluded if you think that it would work out in any other way.Not really; I live in some Chicago suburbs and most of my friends' parents rarely talk to each other. It's how it goes in married life.>Until you carry the idea to it's logical terminus. You don't get it and I don't think you ever will. You would still have the potential for divorce, in an ethnostate women would still be unbearable and would still work against you even if they couldn't officially. You'd just end up framed for something you didn't do and your marriage annulled that way rather than just no-fault divorce.>You know not where you are, nor the conditions in which you live. Yet you expect to be able to dispense advice, guide others to spirituality and establish goals?You may be right about the framing part but it's a rarity; you'd likelier get run down by a car (another modern invention that I am NOT a fan of)However I still believe that it's possible to enforce stricter divorce laws that don't give women nearly as much power as they hold today.>I don't see why they didn't ban the fuck out of you for being MGTOW other than the fact that they hated me more than you. But, that's the case for everyone. I've always been hated by everyone, I will always be hated by everyone. Because nobody wants to admit that all of life is misery and nothing can ever improve.Doesn't matter how hated you are or aren't; as long as you bring in the upvotes they are rarely gonna ban you."
dd8c9lo,,"> Not really; I live in some Chicago suburbs and most of my friends' parents rarely talk to each other.Then it doesn't matter because you'll die in the chimpocalypse anyways.No, you can't enforce stricter divorce laws. Women won't let you. They will not walk backwards. Ever. And you didn't bring the upvotes as much as you thought you did. I'm just more blackpilled than you because I see the reality of things.There is no hope. There is no light. There is no good times. The past wasn't good. The future can never be good. Nothing has ever been good. There is only Eternal Misery."
dd8cbpb,FalloutFan2,Man up
dd8cj2p,,"You first. Get married and have those ten white kids, goy!**I'm right and you know it. Everything is shit and you know it. You cannot use the ""Man Up"" Argument and still be MGTOW. I wonder if they'll ostracize you for that comment? Find another knife, that one isn't sharp enough. You CANNOT shame me into backing down from this.**There has never been anything worth living for and you know it. Women have always been ruined and will never walk backwards and you know it. The left will continue to chimp out and you know it. Chicago will burn and you know it. There is nothing that can stop the coming dark and you know it. It will never be worth living through it and you know it. There is nothing else in the universe but Misery and Nadir and you know it.**There is No Future but Nuclear Fire.****And you fucking know it.**"
dd8crin,FalloutFan2,">You first. Get married and have those ten white kids, goy!But MGTOW don't get married...>I'm right and you know it. Everything is shit and you know it. You cannot use the ""Man Up"" Argument and still be MGTOW. Actually...you can. Only men can go their own way. You clearly are not a man if you choose to let nuclear devastation get you down. I'm preparing the eventual collapse. What are you doing besides harassing people on the internet?"
dd8d8us,,"> But MGTOW don't get married...So man up then. You can sling those knives, but you seem unable to catch them.>Actually...you can. Only men can go their own way. You clearly are not a man if you choose to let nuclear devastation get you down.**You have to be retarded. You cannot lift your way out of Nuclear Devastation. You cannot go your own way out of Nuclear Devastation. You cannot prep for it, survive it or overcome it in any way. You're retarded. Everything should get you down because happiness is lying to yourself.**>I'm preparing the eventual collapse.**No, you're not. You're flailing around uselessly and promoting two conflicting ideologies trying to act like they're the same. They're not.**>What are you doing besides harassing people on the internet?How am I harassing you? Who should man up now? Why can you not refute anything I say?**Because you know I'm right.**There is nothing else to be done. There is nothing else you can do. I've told you about my situation and how inescapable it is, but of course, you refused to listen to anything I had to say because it didn't fit in with your bootstraps view of how recovery from loss should go. You think that people are unequal, yet you think we're all gonna make it? You think that whites deserve a homeland but that women cannot be trusted?**You're more of a contradiction than I ever was!**You aren't prepping for an eventual collapse. You're flailing uselessly in the face of Fate and the gods. They have always hated us. They will always torture us. There is No Future but Nuclear Fire and you **CANNOT** survive it."
dd8dd7x,FalloutFan2,I proved you wrong dozens of times in those pms that you just glossed over and couldn't refute.Now I'm just partaking in the tragic downfall of someone with daddy issues that never was a man and never will be.
dd8dkpb,,"> Now I'm just partaking in the tragic downfall of someone with daddy issues that never was a man and never will be.**Says the MGTOW with alt-right sympathies.**Whatever. How are you partaking in my tragic downfall? Why the fuck would anyone believe you considered it tragic? How are you any more of a man than I am when you won't get married or have white kids? You didn't prove me wrong at all, you just fell back on another argument I'd already heard and de-limbed before because you refuse to acknowledge the effects of failure and weakness. I'm right and you know it. Post the PM's and watch everyone laugh at the both of us. Me for being crazy, you for thinking that you can lift weights and prep your way out of nuclear fallout.How is it a tragic downfall? How is it even a downfall? This is how things always have been, and always will be. Nothing can ever improve. Nothing can ever get better. Life is Torture and nothing can ever change that.**And That's A Damn Fact.**"
dd8dsfg,,[removed]
dd8dsii,youtubefactsbot,">[**JOHN MAUS - LOVE LETTERS FROM HELL [FULL ALBUM] [39:57]**](http://youtu.be/HbiKmuplLs8)>>0:00 - I'VE GOT PROBLEMS - 1> [*^Travis*](https://www.youtube.com/channel/UCEC2xVWo7ZSs-AY3sTAQVjg) ^in ^Music>*^14,106 ^views ^since ^Dec ^2015*[^bot ^info](/r/youtubefactsbot/wiki/index)"
dd8e57t,,"> https://www.youtube.com/watch?v=HbiKmuplLs8&t=2m31sYoutube is blocked at work, You know that. But that music sucks anyways. You know that. Why would you ever listen to anything as degenerate as something named ""Love Letters from Hell""?I'm right and you know it. You only argue so hard because you want to be proven right and to think that there is some hope left in things when there isn't any."
dd8dud2,,"> Cheer up kiddo, did you watch those videos I sent you?You mean the ones with Styxhexxenhammer666 and how all is mind? Yeah, that's some shit from the (((Kyballion))) which is a derivative of Kabbalah, which is more of that solipsistic ""your brain is god hurr durr"" Jewish bullshit.I watched your videos you sent. They're all useless to me. It does nothing but remind me that Kabbalah is Jewish. The universe is not mental. Your brain is not God. I'm 28, you cannot use Kiddo with me. You need to find another knife, that one isn't sharp enough. You cannot ""kiddo"" shame me into backing down from this. I'm right and you know it.**If you want a clearer picture to this universe, it's more like [I have no mouth, and I must scream.](https://en.wikipedia.org/wiki/I_Have_No_Mouth,_and_I_Must_Scream) We are nothing but calcified misery, being tortured forever.**"
dd9qnny,SocialNationalism,Jews.
dd7moys,,[removed]
dd7nae1,FalloutFan2,I see you're incapable of explaining any of your views so I'll just chalk it up to irreconcilable IQ differences.G'day
dd7uzbq,theivoryserf,*needs 'what's wrong about being a Nazi' explaining*How do you look after yourself
dd7v9yy,FalloutFan2,#\#NotAnArgument
dd7vbtm,theivoryserf,"If you don't know why *Nazism is wrong* and you're over the age of, say, three - you're not worth my breath."
dd7vs8x,FalloutFan2,#\#NotAnArgument
dd7tt8a,crazer20,if you can't see what's wrong with being a nazi then there definitely is an irreconcilable IQ difference between you two
dd8j0tu,Mechaniballs,So how was middle school today?
dd9ceca,FalloutFan2,"I already graduated in Electrical Engineering, how about you?"
dd7tse6,Kiwi_EXE,/r/iamverysmart
dd7uk6x,ProllyJustWantsKarma,"This irreconcilable IQ difference is most clearly demonstrated in how you so readily drank the bullshit racialism pseudo-science Kool-Aid, and he didn't."
dd7phaw,0mac,Lmao good stuff. Wish I could tag on mobile. What in the world was it thinking.
dd8m4j6,,> What's wrong with being a Nazi?lmfao holy shit this might just be the most stupid thing I've ever read
dd9c1k6,FalloutFan2,#\#NotAnArgument
dd7ur14,,"The Nazis were genocidal, which I understand the alt-right is not. I'm not a part of the alt-right, by any means, but I have seen that distinction made."
dd7j79g,Rich77u,But commies and violent antifas are ok? BLM calling for violence against whites is ok? Liberals saying conservatives and Donald supporters deserve to be beat and killed is ok? What planet are you living on?
dd7os5h,KOWguy,"Point me to a recognized community that had a post promoting violence on whites, please."
dd848ra,TheTopSnek,"/r/BlackPeopleTwitter mod saying that all Whites should be killed a few months ago./r/againsthatesubreddits constantly saying that Whites are evil./r/enoughtrumpspam constantly saying that all White men who voted for Trump are LITERALLY Hitler and all white women who voted for Trump are LITERALLY sluts./r/GamerGhazi being blatantly anti-White./r/ShitRedditSays and it's derivatives being BLATANTLY against White Rights.Come on dude, you can be anti alt-right, but saying there is no Racist against Whites going on here is just being plain ignorant."
dd86jpg,AnExoticLlama,"sources or it didn't happen Also, your flair is literally white nationalist. That's fucking evil, no two ways about it. Yeah, some white folk are fucking crazy, yourself included."
dd89gs4,Apotheosis276,"Yeah, that's evidence enough."
dd8cxsz,wisdumcube,"I want a neapolitan ice cream nation, but we have to accept the world that we live in.In all seriousness, t's pretty crazy how stupid white nationalist rhetoric sounds when you are a calm adult that is an indistinct mix of ethnicities but still culturally identifies as an American (and a California born citizen, I might add). It really puts things into perspective. I suppose this is something you missed out on since you grew up with the notion that races have an inherent culture or heritage that is worth preserving."
dd935sh,Apotheosis276,Why do they think this though?
ddavxpo,wisdumcube,"The logic of racial tradition and the genetic value of race falls flat on its face when you are born from multiple ethnic backgrounds and it is no longer possible to identify with and obtain strength from such an identity. I also function the same as anyone else around me and don't see the need for that type of identity. I recognize that America lacks a strong cultural touchstone except our history as a colony turned revolutionary democratic state, but that doesn't mean our society doesn't have values you can identify with or that are worth protecting. Those are values that many societies share, like family for example. I guess having no distinct lineages gives me a unique perspective and it allowed me to avoid using race as a crutch to be secure in myself and identity. I never fell into that hole because of my upbringing and background and it is actually a huge weight off of my shoulders. Sorry you feel so threatened by the direction of society but I doubt that reinforcing racial traditions is going to solve the corruption and crises we see before us. Race is a social construct. There is no scientific basis for supporting distinct racial identities. Culture and economics are more important in influencing the stability of any society. I hope you some day you find peace with yourself and the world."
ddb0rnq,Apotheosis276,Did you reply to the wrong person?
dd8mi36,YopperApe,"> I want a neapolitan ice cream nation, but we have to accept the world that we live in.> The world still has predominantly white nations. Yet you libshits keep trying to undermine that."
ddawp9y,wisdumcube,Predominantly? Europe only accounts for 11% of the world's population (740 million). The U.S. has around 300 million. There are more people who live in China alone (over a Billion).
dd8si9i,Rich77u,"> races have an inherent culture or heritage that is worth preserving.Maybe you don't feel this way because you're an ""indistinct mix of ethnicities"". You have nothing left to save."
ddawf7s,wisdumcube,"What is there to save? I feel fine and secure in myself and my identity. Can you say the same about yourself if you remove ""race"" from the equation?"
ddazu7k,Rich77u,Every great contribution to society has been from European peoples. Yes absolutely. My ancestors built the model for every modern government for example while your indistinct ethnicity was stuck in the caveman ages.
dd8aoel,,"yeah, that's retarded at best"
dd8jiy6,JumpyLynx420,"Yeah. White people wanting a place they can call their own? How fucking hateful and bigoted. I guess the Jews should give up Israel, and the Muslims can go ahead and clear out of Mecca too so there's more room for non-Muslim minorities. After all, ethno-nationalism is pure evil right?Get the fuck out of here Schlomo"
dd939em,TheTopSnek,Sources or didn't happen? Go to each. They are openly against whites.
dd987ym,AnExoticLlama,"You made the claim, the burden of proof is on you. Making accusations with the proof of ""just look at em!!1!"" isn't logical."
dd85ipe,KOWguy,"I didn't say there was none, I was genuinely asking for sources because I hadn't seen any."
dd7pbcr,Vape_Ur_Dick_Off,*crickets*
dd7u66c,Kiwi_EXE,But muh white genocide!/s
dd8ylh2,Rickrollyourmom,I'm still waiting on that white genocide that white nationalists promised would come under Obama
dd7uua7,theivoryserf,B-b-b-but there's a white genocide because nobody will sleep with me!
dd7vihu,OneLastStan,"""Someone promoted hate before, why can't we openly promote hate on your site then?"""
dd82xfa,An_Hero_OP,Paging blackladies
dd8761g,leithz6,But W-w-white g-genocide...
dd7kp4s,bannedagainbro,"""Everyone I disagree with is a nazi"", i.e. If you challenge the core of my beliefs, you don't deserve a voice. There was never anything more to it than that."
dd7lb0r,Agastopia,"Well nah, the sub literally posted pictures of nazis glorifying them and denying the holocaustBut keep thinking whatever you want, hopefully delusional people come to their senses eventually"
dd7m837,bannedagainbro,"That's entirely your decision to generalize the whole from the part. The altright was and still is many things, amongst that white nationalists and antisemites. Naming it all as nazis is an unfair simplification, but probably one you are happy to make."
dd7msgv,notoyrobots,"If it quacks like a duck, and goosesteps like duck..."
dd7n08t,bannedagainbro,Then you declare that all pond-dwelling animals are ducks.
dd7n8ib,notoyrobots,"No, they're nazis. Duh."
dd8czc0,wisdumcube,Just because you disagree on the details doesn't mean you don't share a common reprehensible theme. They may be different species of ducks but they are all ducks.
dd8dvxs,bannedagainbro,"> a common reprehensible themeExactly. It's not the methods you want to shut down, you want to shut down people who dare challenge the core of your beliefs. You're not against what they do, you're against the idea that your conception of reality might be wrong."
dd8e5ob,wisdumcube,"I don't think you know the core of my beliefs, so I hazard a guess that your theory is not what ""theme"" I am talking about. Your type is pretty good at projecting though. Why does the alt-right always think that others are just as insecure as they are about the conceptions and machinations of reality? The biggest failing of the alt-right is that they think the rest of the world revolves around their same simple world view, and those that stand in opposition just believe in the reverse of what they think."
dd8el3v,bannedagainbro,"> Why does the alt-right always think that others are just as insecure as they are about the conceptions and machinations of reality?We know you aren't, that's what makes you so dangerous (and stupid). You think you understand reality, so you try to silence others with different viewpoints. > The biggest failing of the alt-right is that they think the rest of the world revolves around their same simple world viewI don't even think the alt right has one world view, so that doesn't make much sense. > I don't think you know the core of my beliefsI don't, but I'm pretty sure that alt right positions challenge it."
dd8feov,wisdumcube,">We know you aren't, that's what makes you so dangerous (and stupid). You think you understand reality, so you try to silence others with different viewpoints.That's not how this works. Security has nothing to do with having all the answers. You simply think we must think we have the answers for security because that is what *you* need to feel secure. You are extremely transparent.>I don't even think the alt right has one world view, so that doesn't make much sense.The common thread between all alt-right beliefs is white nationalism: the idea that white people as a race have been victimized. You think everyone else operates based around racial/ethnic ideals too, just not the white racial protectionism kind (sometimes including racial purity). Or am I wrong? Go ahead and try to define your collection of beliefs more accurately.>I don't, but I'm pretty sure that alt right positions challenge it.Then tell me how you know something you don't know? Thinking that a group is spreading aggressive and delusional nonsense which is causing harm to the stability of modern society is not the same as having your core beliefs challenged because of that group's existence and beliefs."
dd8ydzi,SoupTyrant,"> doesn't mean you don't share a common reprehensible theme.>common reprehensible themeaka ""disagreeing with me"""
ddawdnm,wisdumcube,"I disagree with plenty of people that I wouldn't consider ""reprehensible"". I only reserve that word for people who actually deserve that distinction. Don't put yourself in the same spot as someone who actually has an empathetic position."
ddaxeji,SoupTyrant,"> Don't put yourself in the same spot as someone who actually has an empathetic position.Lol. Must make it pretty easy to argue when you always have the absolute moral high ground on every issue. All you have to do is call someone reprehensible and bing bang boom, argument won."
dday9o3,wisdumcube,"Well, I wasn't actually having an argument, just providing commentary, as in, that's my opinion. And isn't it your ideology that hinges specifically on knowing exactly what the moral high ground is at all times? I don't profess that level of arrogance, however, I do think emphatically that your ideology is based on false pretenses. If you actually wanted to have an argument that can also be arranged. At some point though, we will probably both recognize that our world views and the perspective from which we view the world is so different, there is not enough compatibility to continue the conversation. We can try anyway of course if you are actually willing to listen to what I have to say."
dd88gyx,gerbaire,The word alt-right exists because neonazis want a safe space from being called the N word. Antisemitism and black hate to the point of genocide is exactly that. All people who identify as alt-right understand that genocide sounds bad but are too naïve to understand why.
dd8cjxf,bannedagainbro,">The word alt-right exists because neonazis want a safe space from being called the N wordThat's the current mythology of the left, yes. Of course, it makes no attempt to ask those defining themselves as alt right."
dd7lyz3,andysaurus_rex,"I understand what you mean when you say that people tend to use the word ""nazi"" too much, but that's exactly what the Alt Right is. One of their corner stones is Antisemitism. You can see it here in this very thread."
dd7mq6q,bannedagainbro,"How do you decide what the alt right is? The idea that it is nothing more than nazism is manufactured consent from the sensationalist media, propagated after Hillary mentioned it in one of her speeches written by some internet-savvy intern. Of course, once the general populace has such a thing in its head, the myth self-propagates and becomes fact. When they decided to film Richard Spencer's little parade in Washington and disseminate it in sensationalist form, that is when it really became cemented in the public mind. If you want to know what alt right meant *before* the media decided what it should mean, I would point to [Milo Yiannopoulos' guide](http://www.breitbart.com/tech/2016/03/29/an-establishment-conservatives-guide-to-the-alt-right/). But this has the prerequisite that you let people define themselves instead of letting their worst enemies define them, or at least the idea that it's important to listen to what people say about themselves before judging them."
dd7rzdj,andysaurus_rex,"Alt-Right themselves admit that they are nazis. They had Hitler on the side bar. One of their top posts was of a Nazi rally. A frequent topic of discussion was the ""Jewish question"".I'm not calling them Nazis because I think it's a good insult, I'm calling them Nazis because that's an accurate description of what they are."
