Comment ID,Username,Comment
c5ue8vd,thelastvortigaunt,DEMOCRATS GOODREPUBLICANS BADKARMA PLEASE
c5ufj85,Malkav1379,"Your logic seems sound, old chap. Here, have a karma."
c5ufqkm,thelastvortigaunt,REPUBLICANS BAD
c5ugx2r,erwinthehamsandwich,"Good... good, let the hate flow through you."
c5ukra9,Mr_Pricklepants,"DEMOCRATS BADREPUBLICANS BADKARMA PLEASEMore true, but not nearly as effective."
c5upiy1,chnlswmr,Politician: the only occupation for which you must prove yourself corruptable before you get the job.
c5upj8r,chnlswmr,Politician: the only occupation for which you must prove yourself corruptable before you get the job.
c5ucomq,souv,"What an insightful post. Thanks TexDen, you clearly know a lot about politics."
c5uj8ji,TexDen,"Just thought I would throw that out there, didn't know it would hit a nerve."
c5v36lz,PoliticalHivemind,SO BRAVE.
c5uccuz,HALLZY69,"Is this really what /r/politics is? Someone posts some idiotic statement, with no evidence, and gets front page? Really?"
c5ucen8,Outlulz,"As long as it's pro-Democrat and anti-Republican it usually makes the front page, yes."
c5udn5v,tregea,"I know right? i more of lefty myself but all this republican ""bashing"" is taking up way too much of reddit"
c5uflkg,Bake-me,both parties suck end of story
c5ulhtn,Duthos,"That's the end of their stories, but it might be the beginning of johnson's."
c5udzsz,Traithan,"Well, when one party has polarized itself so badly that they would sooner see us default on our debts, have its people die of preventable medical issues, and continually use a propaganda machine to lie to the many unfortunately uneducated citizens of the country (Note that they want to keep them uneducated, Republicans across the board continue to defund any meaningful education bills) then yes, they deserve all the bashing they can get.I like my country, and I want to stay in it. If the extremist conservatives take control of the Executive and Legislative branches again, I would be forced to leave."
c5ueffc,TonyCheeseSteak,"Let me start with this statement. > Note that they want to keep them uneducated, Republicans across the board continue to defund any meaningful education bills)So in your opinion we need to spend more money on education. That is a fair enough opinion but may I ask what you suggest we throw that money at? Give me some ideas because since the 1970s our education spending has drastically raised while test scores have not. [Here is a graph showing the increases](http://4.bp.blogspot.com/_otfwl2zc6Qc/SqgYwPKlGCI/AAAAAAAALSA/XJI3BUM5Mn8/s400/cato.jpg) It certainly seems to me that throwing more and more money at education hasn't done much to help, but if you think it will please supply actual solutions rather then just bash another party. Furthermore, the last Republican president (the party you say cuts spending to education) increased student financial aid by 20$ billion. Funding for elementary and secondary education increased by $5.1 billion. funding for state special education grants under the Individuals with Disabilities Education Act grew by $4.6 billion, all Bush's doing. Most of which I disagreed with but you should know your facts before you make false statements. > Well, when one party has polarized itself so badly that they would sooner see us default on our debtsAs far as default on our debts, please inform me on something EITHER party has done to attempt to prevent this? I would love to hear it since it seems all each party can do is spend more and cut nothing so I would certainly be interested how you think the left is fixing this problem. Edit: I am trying to get to as many replies as possible but I am not home nor will be for a few days so I've been trying to reply as much as I can with the little bit of time I'm getting on a computer. So it will take a few days probably but I will try to get to everyone with a good as a reply as I can. Appreciate the replies and always enjoy some nice civil discourse."
c5ufg3h,chono,"On that note, it has been pointed out that with ""everyone"" getting an education, of course the average will plummet. Individuals who simply can't function well in an academic atmosphere. Some are just meant for labor jobs, and that's great.Honestly if everyone went to school and got great scores to drive up averages, I don't know what would happen in the economy with so many prepared for service sector jobs and not skilled labor roles. It's just one of those unfortunate truths to a society."
c5uj48s,vvelox,"> Individuals who simply can't function well in an academic atmosphere. Some are just meant for labor jobs, and that's great.Not functioning well in a academic environment does not mean some one is going to be working a labor job. I personally hate all the pointless large and required homework that gets in the way of studying, so I said to fuckery with college and left to work in the unix field."
c5wms6b,chono,"Just getting to this now, but good on you for getting past it. The generality really is that those who don't excel in academics (structured uni, etc.) typically don't have the drive to pursue other avenues, and settle on where they land in those first years out of high school. Again, generalities."
c5uev6g,JoshuaFB,Its not always about the money. I don't know how but we need to reform the system so that it works better and doesn't just teach kids how to take standardized tests. Education also occurs at home. That is all.
c5uive2,juanchopancho,"Yes you do know how. Look at Finland, that is the model. For drugs look at Portugal."
c5v3p0r,BerateBirthers,Eliminate grades. Let students come to *learn* not *to be taught*
c5uhvj2,grande_hohner,Home schooling for everyone!!!!
c5uk719,Panzergrenadier,we're dumb enough thank you.
c5uk89m,Hijoshikina,"Frankly, it's not about the money being poured into education. Our way to teacher students sucks, especially when we think about how our country is ran. You could beat children with gold bricks that is the education fund, but we live a place where war is more important than anything else. > Funding for elementary and secondary education increased by $5.1 billion. funding for state special education grants under the Individuals with Disabilities Education Act grew by $4.6 billion, all Bush's doing. Most of which I disagreed with but you should know your facts before you make false statements.I find this really silly since when we speak of one topic we seem to ignore the defense budget which has been reaching all time highs. Not just in our country, but still."
c5urfs8,lovethismfincountry,the defense budget has nothing to do with his point. he was talking about all the spending we pour in to education with no results. whats your next r/politics talking point to counter his **facts**?
c5ursb4,Hijoshikina,"All I ask for is all the facts bro, nothing more."
c5uk3qf,,Test scores would probably be a lot higher if the dropout rate was similar to what it was in the 1950s.
c5urexk,lovethismfincountry,but instead we dumb down the curriculum so the stupid kids dont get butt-hurt.
c5ueqns,gynoceros,"Make kids perform up to certain standards or get left back. Parents will get kids' asses off of the xbox if they know it means an extra year of having junior live at home or, worse yet, being seen in public by another soccer mom who knows your kid couldn't hack 4th grade.The education money goes to re-educating those kids until they can read and write at grade level, pass a math test without a calculator, and correctly label a map, for starters. Add specific science requirements later on."
c5ufigh,namefaceguy,This is a silly statement. Reeks of no child left behind. We don't need teachers to be tough on kids to pass the test. That's what got us in the mess. As someone who came out of high school 7 years ago I know whats happened. Kids aren't stupid they will rebel when they know something doesn't make sense. What we need to do it make kids want to learn. We need to make school a reasonable enjoyable experience where kids aren't forced to be silent and obedient and where questions aren't met with hostility. More test are not the answer.
c5ufnwi,teacherdrama,"Bingo:>More test are not the answer.How about NO tests? None. How about we leave education to the people who have STUDIED to become teachers? How about we TRUST teachers to make decisions about their students? Tests SUCK. Tests are KILLING education. (I'm saying this as an educator for the past decade). We keep talking about how to test the kids, the tests will tell us! No, they don't. At their best, they are inaccurate and RIDICULOUS assessments of what the kids are learning. I keep hearing we're going to increase testing - I feel so bad for these kids who simply aren't LEARNING. Education is publicly funded so gets put into talking points by politicians, but politicians should stay the hell away from something they literally know nothing about."
c5ugnct,Oscar_Wilde_Ride,"I would do away with all standardized tests. I understand why administrators want tests and data, but they are doing more damage than they are worse. In medicine, you don't do a test if it is more harmful/more costly than what you want to cure. The same should be done in education."
c5ug06b,s0ck,"School is less about ""knowledge"", and more about learning how to think. How to solve problems. College is about knowledge, that's when you should be tested for retention of facts."
c5ug456,JustAnotherJon,"How do you propose we determine academic success? This is a ridiculous statement. I'm sorry but when folks enter the professional world, guess what they get evaluated on?Series 7, CPA, Law boards, MCAT, SAT, DAT, LSAT, ACT, MAT, OAT, PCAT, , VCAT, WTMA, TOEFL, NAPLEX, NAPLEX-RN, NAPLEX-PN, performance exams, Contractor's Test, GMAT, GRE, AP, CMA, chiropractic exams, and I could go on and on and on. The fact is when students enter the real world tests are essential. Sure they aren't perfect, but how else am I supposed to evaluate someone I don't know? I can't assume an individual is a good hire simply because they have a good interview. Tests aren't going anywhere. Teaching our kids how to test well teaches our kids SOME of the skills that are necessary to succeed in the world.People are evaluated on tests. The may not be perfect, but they are the most cost effective way to evaluate a potential job candidate."
c5ugdbp,teacherdrama,"I don't disagree with you - but you're talking about tests being given to 21+ year olds. That's VERY different from barraging 12 year olds with tests.Tests NEED to be given, of course, but standardized tests are disastrous in elementary/middle schools especially. Let kids just LEARN in those grades. Teachers can give tests for their subjects (this would require admins to release some power). You can start with standardized tests in high school - SATs and HSPTs or whatever. If you saw the tests my kids have to take, you'd change your mind. Questions are poorly worded. Articles are deadly dull and outdated (how this happens on tests that have had millions spent on them is beyond me), questions have more than one viable answer. I've seen typos, I've seen mistakes in directions - these tests are terrible. What's worse, they show NOTHING about what a kid learned during the year. If I teach a kid the joy of the humor of Shakespeare in Midsummer Night's Dream, is that tested? If I teach them to write a strong opening to a story by drawing the reader in - but they need to rewrite three times to get there - does that get tested? Testing below high school is detrimental to student learning. Want more proof? I got out of school before this nonsense started. Most of us over the age of 28 or so did. We got along just fine before all this testing nonsense started. Our kids are getting dumber. They are. I've seen the shift in the kids over the past decades - they're not as sharp as they were when I started teaching. Every teacher I know says this. What's changed? Testing."
c5ukm12,stopit,then fix the test if the questions are poorly written. you have to have standards across the country and the only way to assess them is with a test.
c5ukxnp,teacherdrama,"I maintain two things: 1)that's very limited thinking about educational policy, and 2)we have zero control over the test. The administration (re: the school board) decides on the test and buys it from an independent company (capitalism at its best). We are stuck with whatever test we get because the district has a contract to give out the test for x amount of years. Supposedly in two years we're changing tests - to one that tests four times a year. Brilliant, no? Additionally, why do we need standards across the country? What is effective for a student to learn in even one part of a state is different from what it might be elsewhere. A test that is given to the richest suburban districts and then given to those in the inner city is going to have vastly different results -- but it certainly doesn't show LEARNING happening. A kid can go from a third grade to a fifth grade reading level in a year, but if that kid is in seventh grade, all that learning means nothing - and the test will not show the advancement."
c5un2dx,stopit,"again, if the test are bad, lets find a away to get better ones. replace the administration if that is what it takes. capitalism has nothing to do with it, the fact you bring that up makes me think you are just trolling.your second statement is pretty racist. all kids should be expected to reach a standard. making excuses for minorities does nothing but harm. if you don't test, how do you measure advancement? ask the kid? ask the teacher? ask their parents?"
c5unkdx,teacherdrama,"I agree completely that we need to change the tests and change the administration. Testing has EVERYTHING to do with capitalism, and the fact that you don't understand that is WHY the tests will not change. It's ALL about the money. Believe me, I'm not trolling. I've been teaching for ten years.My second statement is not at all racist. And why should all kids be expected to reach a standard? 1)I never said a word about race - you read that into my comment. 2)People are born with individual talents. Some are geared towards school, some aren't. Similarly, some are musical, some are athletic, some are artistic. Some aren't. Why should all kids be forced to reach the same arbitrary standards? Some kids have developmental issues, or learning issues or any of dozens of other possibilities.How about measuring advancements of students by leaving it to the people who, again, trained for their jobs, have hundreds of hours of continuing education beyond school, and spend every day working with the kids? How about giving teachers the responsibility to deal with their students' advancements?In an ideal world, teachers would have that responsibility, tests would be long forgotten, and students would learn as was appropriate to their needs. Of course, all this would require a TON of money coming into education and a complete overhaul of the system. I don't see that happening any time soon."
c5uo42j,stopit,"we spend more money than the next 10 countries combined, more money is not the answer."
c5uoind,teacherdrama,A well thought out response.
c5uqv7s,JustAnotherJon,"Thats a relevant point as to the age of the test takers. When I went through grade school we took one standardized test at the end of the, but it didn't determine whether we passed/failed. It was just to make sure the private schools were up to par with the public ones.I'm 26 so I'm not sure if I got the rigorous testing that our current generation is receiving. Call me sick, but I've always looked forward to tests. It's a chance to compete against my peers and put my learning into action. I just don't see anyway that we can get good data without testing.Do you think that the dumbing down of our kids could possibly have more to do with the ""cool"" culture? It seems to me that often times certain segments of society just simply teach their kids not to care about education. They get it from the TV, movies, etc. I don't really understand this. In high school there were some of my friends that could most likely be stereotyped as ""rednecks"" and if the succeeded in school it was like they were betraying some strange sense of culture. However, when I was in a fraternity in college it was most definitely not cool to struggle with your grades.I feel like our culture plays a big part in the next generations attitude toward school work."
c5uqzxz,teacherdrama,"I do think that's part of it. The culture from movies, tv, and video games making stupidity a positive factor in life is just incredible. I knew the (so to speak) shit hit the fan when Jersey Shore became the most watched show by my 7th and 8th graders. How scary is it that 12 and 13 year olds biggest influence was Snooki and The Situation? The show reeked of stupidity and my kids ate it up.The scary thing is, I work in a pretty good middle class district. The problem, though, is that school (at least when I was going) was supposed to counter all that. Tv and entertainment in general is fine - you can laugh at idiocy - but when the school culture doesn't encourage intelligence what chance do the kids have? When we just pass them right along regardless of their scores, what motivation do they have to learn? When what little sense of placement they get comes from these ludicrous tests by a WIDE margin (teacher input is so minimal as to be farcical), why should kids unless motivated by their parents care? I can't tell you how many students I've had whose parents just can't be bothered, and so the kid fails. The whole system is terrible now. It really needs an overhaul, but like I said in another post, I just don't see it happening any time soon."
c5uhcty,Oddjob1313,"Quite frankly, I quit taking grade school seriously by the end of 9th grade because of how backwards it felt to me. I hadn't done work nor tried seriously in years, but by high school it all just seemed pointlessly stupid. The teachers either didn't know what they were talking about because tenure allowed outdated teachers to continue babbling on for years and years past their expiration date, while tests just forced us to regurgitate factoids of information back at the teacher with no real learning.To explain how pointless grade school has become, I left high school with barely a 2.0 GPA, went to a community college, got a 3.7, then got accepted into on of the top 40 best colleges in the country. And I literally didn't go to the second half of my senior year."
c5ulh8x,,For the most part your never taught how to apply any thing you learn.That seems kind of backwards to me.
c5uhxzc,aredditormaybe,"Well if you graduated 7 years ago, based on what you say, you must be 35 now, single, have no kids, and play WoW 24/7! Why should we let kids learn on terms that they accept based on their social life or own personal lack of discipline, thats what you are really saying right? While many kids don't succeed, there are many more that do, you may call them nerds or geeks, or maybe even young redditors. ""reeks of no child left behind?"" What is so terrible about that? Do you even know what it is, says, or stands for? Maybe if we didn't have such low standards for teachers, and even lower expectations of parents and community, then we wouldn't have drop out pukes like you posting on reddit!"
c5um2ip,namefaceguy,"Are you serious? how the fuck did you get 35 out of that? Even if for some reason you thought I was talking about college you would still be off by 6 years. I was talking about high school. I am 25 and lived through the no child left behind years. My school lost funding because it was a bad school. So they take the schools that are doing poorly and the solution is to take money away from them to ""punish"" them. Some kids had to sit on the floor and we were learning science from text books from the 60's. All because of this retarded let be tough on grades mentality. It's ignorant and dangerous."
c5ukhhm,gynoceros,"The teachers shouldn't be the ones hard on the kids, the parents should be.Our oldest was slacking off in school, and got a few Cs, which we knew wasn't his best work, so we had a talk with him, limited his video game and TV time, stopped taking his word that he'd done all of his homework, and by the end of 4th grade, he'd gotten 100% on his states and capitals, is second only to the Asian kid in math, and has vastly improved his creative writing.Over summer break, he gets to slack a lot, but he also has to spend at least 20 minutes a day reading.Parents being involved is the key. Some parents won't get involved unless they think their own status will be affected."
c5ulxhp,7Redacted,>That's what got us in the messYeah. Our education system was doing *splendid* before NCLB.
c5ug7if,fishmaster2012,"They have that. At my high school, If you didn't pass the end of course exam, you wouldn't get credit for the class, no matter what your grade was."
c5uizdj,Samueul,"You don't live in the real world of having kids, knowing people who have kids, and dealing with the public school system do you? Because if you did, you'd know that your statement is 100% full of shit."
c5ukdd6,gynoceros,"I like your assumptions. They're wrong, though."
c5ukjaa,Samueul,"""Parents will get kids' asses off of the xbox if they know it means an extra year of having junior live at home or, worse yet, being seen in public by another soccer mom who knows your kid couldn't hack 4th grade.""Assumptions? Sorry, but you must not know any parents."
c5unbvq,legion02,The scaling on that graph is horribly misleading. It also doesn't take into account the increase in difficulty of testing.
c5ufpff,despicable_secret,"I'm a libertarian, so public education gets no love from me. But one thing that sticks out to me is that, yes. We have increased funding with little change in test scores. But over that same time, we have also begun to educate people who previously didn't figure into the scores. The overwhelming majority of them come from groups that statistically test poorly.http://westhunt.wordpress.com/2012/05/29/educational-reform/"
c5uhlci,TonyCheeseSteak,"I agree with this, I was just trying to shed light on the falsities of the comment I was replying to. Also test scored vs many EU countries become skewed because they have a very different schooling system then us where many kids go into trade schools at I believe our age of high school."
c5ufqwj,xena_derpina,"Is this adjusted for inflation? Your whole post sounds like fluff to me. Student loans get paid back with interest, so they don't really cost the govt much. Ask any city or state board of education and they can tell you that education spending has been cut over the last 10 years. Also, our testing requirements have changed. Is everyone being graded on the same tests as they had 30 years ago? What about the fact that in the 70s, you could pay for college without loans working 20 minimum wage hours a week, because we taxed the wealthy to supplement tuition? And the gop is very extreme right now because moderates don't vote in primaries anymore. Obama is more like Reagan, and no way would Reagan even have a chance now. In Wisconsin, Reagan-like Tommy Thompson is getting panned for being too moderate. And according to fox news, moderate = liberal. 20 years ago, moderate = conservative."
c5ukgzj,spelczech,"Doing some rough math on that graph, it looks like education spending went up less than 3% a year. A lot of people wouldn't even consider that a cost of living raise, let alone actually improving education.I agree with a lot of people that the problem is less how much to spend and more how to spend it wisely and with the most affect."
c5unaoy,loondawg,">As far as default on our debts, please inform me on something EITHER party has done to attempt to prevent this?Obamacare. You know that 700 billion than Obama is supposedly cutting from Medicare? That's savings over the projected costs without Obamacare.And do you have more information on that chart? I'm curious what the possible range is on that second axis. Is it scaled to minimize the improvement it shows in math scores? And why does it only show until 2003 when it was from 2007 data and using 2008 dollars? etc...I ask because my public school teachers taught me to always question data since it is so easily manipulated."
c5uf2m9,rmmdjmdam,"Getting out of wars will seriously help us reduce the deficit - the military budget for 2004 was already at $399 billion while by 2009 it had reached $799 billion with the global war on terror directly accounting for nearly $200 billion of that. By comparison, non-military discretionary spending stayed flat at $383 billion during that period.Regarding avoiding defaulting on our debts? The US government is capable (as it showed this time last year) of raising the debt limit to prevent us from immediately defaulting on the debt. Regarding balancing the budget to pay off the debt, yes that's a different question. So which one are you referring to, because the Democrats were in favor of raising the debt limit last summer, while the Republicans did not agree until the 11th hour, which more than any other factor caused the downgrading of our credit rating."
c5uhmjk,TonyCheeseSteak,"I don't believe raising the debt ceiling is any sort of sane solution as it solved nothing in my opinion. As far as the downgrading of our credit rating I don't really see how how late we raised our ceiling played into that, at least not more then any other factor. I believe the biggest factor would be the fact that we can't control our debt, our debt is speedily rising, and we had to raise our debt ceiling as our only solution."
