Comment ID,Username,Comment
c5umzaf,nfirm,Welcome to /r/progressivecirclejerk
c5uixv2,canthidecomments,"At least they've descended to the state where they're now openly mocking Barack Obama as one of the worst presidents ever ... and alleging that Romney might be worse by trying to create envy in people because Romney has been so much more successful in life than Obama.That's progress - of a sort.The five stages of getting over Obama:* Denial (this is where they started out)* Anger (stayed here almost two years)* Bargaining **(this is where they are now)*** Depression (scheduled for November 7, 2012)* Acceptance."
c5ujzk1,Shoden,"> Romney has been so much more successful in life than Obama.Funny, one of them became president of the united states first, I would say that makes Obama pretty successful."
c5ut0l9,canthidecomments,"If that's the only measure with which you define greatness, then you'd be right.You'd also be very shortsighted.When you think of Barack Obama, and his accomplishments, do you think ... ""now there's a great man.""No, you don't.He stumbled his way through life voting present and working the system by trading on his skin color to get perks none of the rest of us get and became an accidental president by a quirk of history and having ""dirty"" Jesse Jackson to compare his ""clean"" self to (in the words of Joe Biden). Recall the awarding of the Nobel Peace Prize that he was so embarrassed to receive having done nothing to earn it that he gave all the money away and admitted he didn't deserve the award. Then launched a third war - undeclared and unauthorized by the United States Congress, mind you - against brown people for their oil.I know of nobody who thinks Barack Obama is a great man, or believes he has done anything great.And you don't think he's a great man either.(PS: You should capitalize United States when you write it out ... or it makes you seem like you're trivializing your country.)"
c5ut32r,Shoden,"> If that's the only measure with which you define greatnessI said nothing of greatness, only success. Obama has successfully become president. If this wasn't something to strive for, Romney wouldn't be doing it either I suppose."
c5ut7x3,canthidecomments,"I agree with you.Obama isn't a great man, and becoming President isn't the measure of greatness, or success, in a man."
c5utawg,Shoden,"> I agree with you.> Obama isn't a great man, and becoming President isn't the measure of greatness, or success, in a man.I never said Obama wasn't great, just that the act of becoming the president is a success, one Romney has not yet achieved."
c5uv0k5,canthidecomments,">I never said Obama wasn't great,You also never said Obama IS a great man (I noticed that).You didn't say that because you don't believe that he is a great man, owing to his lack of any fundamental accomplishments in his life.He became President (which you describe as a success, but which I say is debatable), by an accident of history and timing ... and certainly not as a reward for any of his previous accomplishments (like a Ted Roosevelt), because there weren't any, just like he was awarded the Nobel Peace Prize for nothing (then bizarrely started murdering Americans to prove how much he deserved the Peace Prize. Or something.)Becoming President in the way that Barack Obama became President - a nation attempting to demonstrate to itself that it wasn't racist - doesn't confer on an individual an actual accomplishment. You have to do something worthy AFTER you become President besides bomb brown people with drones.Obama was ""clean"" as Joe Biden said. The first ""clean"" black man (not really black, though) to ever run for the Presidency (clean, at least compared to his competition ... Jesse Jackson, who fathered kids out of wedlock). And so he was elected. And then he accomplished not much of anything (unless you count forcing poor people to buy insurance from his donors or risk having the IRS seize their homes) before he's shuffled off into the pages of history ala Jimmy Carter (another accidental President elected only because of one-off circumstance.)"
c5uv486,Shoden,> You also never said Obama IS a great man (I noticed that).He is a Fantastic President.> a nation attempting to demonstrate to itself that it wasn't racistBy that logic Romney would only become president due to the nation trying to prove it doesn't discriminate against someones religion. But we both know you don't care about logic.
c5uv773,canthidecomments,">He is a Fantastic President.You still haven't claimed that Barack Obama is a great man.Because you don't BELIEVE he's a great man, who has done great things.I can see EVERYTHING you're NOT SAYING about this guy."
c5uw28l,Shoden,"> You still haven't claimed that Barack Obama is a great man.Well, I'm not saying that he isn't a great man. > Because you don't BELIEVE he's a great man, who has done great things.I never said I don't believe that.> I can see EVERYTHING you're NOT SAYING about this guy.And I see everything you are saying about Romney, who you don't seem to like but praise and defend non stop."
c5vowv8,canthidecomments,"Try to post this story to /r/politics (with no commentary, and using the original headline):[http://mobile.nytimes.com/2012/08/19/opinion/sunday/coates-obamas-perceived-transformation.xml](http://mobile.nytimes.com/2012/08/19/opinion/sunday/coates-obamas-perceived-transformation.xml)I tried to post this story, and got the following response:>This is an unofficial, automated notification that the following post appears to have been removed by the spam filter or moderators of /r/politics>>Ta-Nehisi Coates, writing in the New York Times: Barack Obama has become Dick Cheney>>submitted 4 minutes ago by: clyde_taurus to politics>>A moderator may have left a comment on your submission explaining why it was removed. If you have received no explanation you may wish to message the the moderators of /r/politics>>Most often, posts are removed for failing to follow a sub-reddits rules ilisted in the sidebar. You should read the sidebar of /r/politics to make sure your post meets the requirements.>Helpful Links:>> Search to confirm your post is missing> Message the moderators to request approval or find out why your post was removed> Post to PoliticalModeration if you believe the removal was unfair>>Information gathered by the ModerationLog bot> >created: Aug. 19, 2012 10:16 p.m. score: 1>first seen: Aug. 19, 2012 10:14 p.m. upvotes: 1>last seen: Aug. 19, 2012 10:14 p.m. downvotes: 0>missing: Aug. 19, 2012 10:20 p.m. comments: 0>Opt-Out>>If you don't want these notifications in the future send a message with the subject ""Don't spam me bro!"">>If you reply to this message your message will be forwarded to /u/go1dfish (author of this bot). /u/go1dfish does not moderate /r/politics and can not help you determine why your post was removed.>>Please direct such questions to the moderators of /r/politics Moderators of /r/politics are systematically removing any post critical of Barack Obama, no matter whether it meets the posting rules or not.A Gestapo.That's what /r/politics is."
c5vrqa5,Shoden,"I have never received a deleted notice, but was this the headline you submitted?> Ta-Nehisi Coates, writing in the New York Times: Barack Obama has become Dick CheneyBecause if it was, that was neither the verbatim title, nor a direct quote. It was a paraphrase at best.Not only that, but clyde is your submission troll account, and a known one at that. It may be flagged.You know, there is the whole thing about not spamming the same link, and since you tried to use the mobile version of a link already submitted [here](http://www.reddit.com/r/politics/comments/yg8kn/in_republican_eyes_barack_obama_has_gone_from_a/?already_submitted=true), it's no wonder that got deleted.And hey, that link is still there a day later, so your whole point amounts to a big pile of nothing. Try harder."
c5ud82n,sspaiva,"I've said it before, and I'll say it again. These types of posts are exactly what is wrong with our current political system. There are criticisms to be said of both parties, no doubt about that. However, you cannot make vast (and I truly mean vast) generalizations about an person or, even worse, an entire political party like the way you just did. To say Romney and Republicans 'doesn't give a fuck about anything but their bank accounts' is so fundamentally biased, it's almost inconceivable. What kind of statement is that? Where are your facts? Who are you to summarize an man's entire life just because of news headlines that you read? The same goes for Obama as well. Just because you've read what you want to read, doesn't mean that Obama is a perfect angel. Nobody is. I think our political climate would be entirely much more refined if more people just learn to have some objectivity, and be open to all sides of an issue before offering an opinion on it. /rant"
c5udqxi,,"I've said it before, and I'll say it again. These types of posts are exactly what is wrong with our current dialectical analysis.There are criticisms to be said of both styles of writing, no doubt about that. However, you cannot make vast (and I truly mean vast) generalizations about hyperbolic dialogue, or even worse, an entire art of metaphor and allegory, like you just did. To say an exaggeration 'doesn't indicate a fuck about its underlying basis' is so fundamentally biased, its almost inconceivable. What kind of statement about statements is that? Where are your concrete evidence? Who are you to summarize a literary device's usefulness because of a redditor's post that you read?The same goes for logical understated dialogue as well. Just because you've read something reserved and boring, doesn't mean that understatement is a form which promotes perfect truth. No form of dialogue does. I think our political climate would be entirely much more grammatical if more people just learn to read between the lines, and were open to all styles of writing before offering an opinion on it./critique"
c5udw8m,sspaiva,Touche sir.
c5uegj2,Kleemin,I took english in college and now all I can do with that is grammer nazi the interwebz
c5ujttt,LordBaelish,"I'm sorry, which part of that was correcting grammar?"
c5ue6mi,luveroftrees,hahahaha
c5ue7ti,carporsche,You should be a writer ;-)
c5udq0d,bandini813,"> I think our political climate would be entirely much more refined if more people just learn to have some objectivity, and be open to all sides of an issue before offering an opinion on it.But then one party wouldn't always be right about everything. This makes no sense."
c5uh1q6,Colorado87,Lol sarcasm.
c5v3rfb,BerateBirthers,No but one party is always *wrong*
c5v46qm,DreadPirate2,So says the troll who is proven wrong on a near-daily basis.
c5uec68,lgodsey,"I will admit that the Democrats aren't always right, but fuck me if the Republicans don't somehow manage to always be in the wrong."
c5uh5db,Colorado87,"Your comment expresses a MAJOR problem with how people think nowadays. I want YOU to tell me what the Dems have done right. What amazing thing has Obama done?Politicians are too often thinking like you; ""I'm right, you're wrong. I don't care about your opinion."" There usually is no 100% right answer. Sorry. People/politicians have got to WORK TOGETHER, and figure it out together. That is where you get the best outcomes. Both parties are guilty of this, or, I should say most people, period.If you want this country to progress, don't sit on your ass and get in the mindset that ""the world will get better if they do exactly what I think."" It's not going to work out like that. Instead, get up off your ass, help the other people thinking the same thing stand up, talk about it with an open mind, and figure it out!"
c5udw94,,I have only one upvote to give...
c5uelis,PincheGreen,i agree most folk that make post such as these generally don't have a clue about our political agenda I guess that goes for a majority of my generation. The funny thing about our economy is if you look back all the way to Nixon and his term as president then you would know our plummeting economy didn't just start with the bush campaign but it has been a shell casing of shit stacked to the ceiling of parliament disasters and just in the last 8 years or so do people actually see some what of the truth. The blame can go to both parties but it also has to do with not enough people giving two shits about today's politics and that's why we have a majority of senseless voters today.
c5ukd1v,YouthInRevolt,">if more people just learn to have some objectivity, and be open to all sides of an issue before offering an opinion on it. But where's the karma/upvote potential in that?"
c5uet53,JordanLeDoux,"It's plainly apparent that Republicans have things which they would not sell out or budge on philosophically. Among them, I believe, is the preferential treatment of Christian values, which is something that some people want in our society.Another, I think, is the ability of our military to assure the destruction of any other individual country if we had to, which there are a great number of people who view as prudent. Many people don't think too hard about it, but America as a society was deeply scarred by WW2. (Which is not to say that many other countries were not left with deeper scars.)I think in a lot of ways, the US people came out of WW2 going, ""holy shit, we've just been over here doing our thing and the whole rest of the world is batshit insane!"" For some, there was a feeling that we had been sensible and steadily improving for the past 150 years, and that the rest of the world appeared to be like overly destructive children. It's a description of the emotive response of the populace.Republicans are still mostly in this mindset. They view us as the adults, and think that the rest of the world is full of 5 years olds that will cause a mess as soon as we turn around. It's not strictly speaking a crazy position to hold, but it is a very ethnocentric one, which IMO is primarily caused by the fact that we teach very little history to people, especially history of the rest of the world.To many Republicans, no one ever taught them the series of connected events and circumstances that the rest of the world went through in the 18th, 19th and 20th centuries, and without that information history really does look kind of like:""Oh hey, here's America, just doing our thing and making progress... Oh, what the fuck!? Why is a WHOLE continent going to war over a stupid royal figure guy? Well at least the people that started it lost... wait, how the hell did they come back with all those tanks and shit!? And why are they collecting all those civilians? They're killing them with pesticides!?! Oh Jesus! Where's the part where we knock these sick bastards out!Well goddammit, why didn't we do shit BEFORE we got bombed?? Well at least that's over... I guess we'll have to give them a bunch of money to rebuild... wait a minute... why is all that liberated land in the East still being controlled by Russia? Hey! He's putting people in camps too! Shit, and now they have nuclear bombs so we can't force them to stop... Well what if they keep doing that around the rest of the world? Better look into that... Wait, what's that noise in China? Wait, Korea? Vietnam? Shit, Afghanistan? Iran? Iraq?When will it stop?""Without all the historical context of the REST of the world's history, it kind of looks like we're perfectly reasonable, and everyone else is absolutely fucking bonkers.It also helps if you hide some of our history with regard to the CIA."
c5ug2mk,despicable_secret,Alert: insightful comment in r/politics.I point that out only in case someone mistook my upvote to merely indicate that the comment is anti-republican.
c5ug5ke,JordanLeDoux,"Which is most amusing because I agree more with the Republican philosophy, thought not the ideology."
c5uibqd,someotherguy4112,"I promise this isn't a sock puppet, I'm a lurker who felt the need to chime in here. I will preface this by saying I'm a moderate and neither Conservative nor Liberal and if it helps anyone my favorite senator (who the republicans loathed) was Olympia Snow.Anyhow the US's Military policy isn't about WWII aftershock or some idea of us as a grown adult policing children. That is an incredibly childish point of view and the people who advice our President and Congress on military policy are not children.What happened during at after WWII was that the policy of isolationism the US had been practicing was proven to be false. That events happening on the other side of the world could have repercussions and effect the USA, those repercussions could be both negative and positive. The logical following this is that if the US wanted to have an effect on those events and attempt to coerce them to what is good for the USA.I know the instant reaction to this is shock and horror, please realize that nations have no morals nor are required to have them. Nations are composed of people and therefor what is best for those people is best for that nation. The government of any nation's first priority should always be to seek the best for the people it represents. Nations are in effect self serving entities. That's how it's been since the first gathering of walking apes decided to form a tribe. This isn't so say governments always do their job, that's a different argument altogether.The Military is a tool, nothing more nothing less. It's purpose is to create and control violence as ordered by the government. This violence may be offensive or defensive, again controlled by the government which is supposed to be representative of it's people. Ultimately the military serves the national interests. One of the way it serves a nations national interest is in projecting power, which is just another way of saying to make another nation do what you want them to do. Again *shock + horror*, yet nations are amoral and seek their best interests, hence the presence of a military.Now that we've went over that, this is why the US does what it does. It is in the US's best interest that no aggressive superpower is formed that could incite another World War. Under this policy small limited regional conflicts are acceptable if they prevent the creation of a World War. For the better part of 60 years this policy has worked, there have been no major conflicts. We're counting dead in thousands not millions. I honestly hope our future leaders understand this policy and that the military isn't a police force for ""World Peace"" but a tool to ensure no World War III happens. Using this policy it should be clear to anyone why the US builds bases where they do and why they spend so much. It was determined to be cheaper in the long run to fund an advanced active military capable of stopping anything on the planet then it was to have another World War. Korea was an attempt to stop the spread of communism and thus prevent a large alliance between the USSR and other communistic nations. Vietnam was the same. In both case's the US was fighting Chinese fighters equipped and funded by the soviets. We won once and it yielded a country that ranks in the top 15 of world economies, we lost another and anyone can freely look up how that turned out. Also remember both Korea and Vietnam were started by Soviet backed communist factions who decided they wanted to run their respective countries. Afghanistan was a UN operation not a US one, this is commonly forgotten in world propaganda. There existed an aggressive force that decided it would like to go around attacking and harassing the USA and anyone else it liked. If the USA wouldn't of done anything then it would be been very bad. Iraq was a sh!t storm that we never should of got into. There was absolutely no geo political reason to deal with the utter nightmare that turned into. There is also no reason to stay around in Afghanistan after their ruling religious faction was destroyed, it's not the US's business to go around creating nations. I hope our future leaders learn these lessons and do not ever commit the force to any situation that isn't in the best interests of the USA.Now I'm not arguing how effective our leadership has been in following this basic principle, they are humans and humans make mistakes and can be wrong. Honestly IMO I think Obama has done a great job so far. He has not caved to the extreme left members of the Democratic party and he is obviously not a conservative. That puts him as a moderate liberal regardless of how far right the conservatives move. Unless the Republicans can pull some sort of insane magic between here and November to convince me otherwise, Obama has by vote so far."
c5uecg5,mouthbabies,"[This says basically the same thing, but funny.](http://news.icanhascheezburger.com/2012/01/06/political-pictures-barack-obama-stephen-colbert-colbertisms/)"
c5ueg4b,executex,"Stop with the false equivalency. Being ""Fair and balanced"" and saying ""both parties have faults,"" is exactly why Republicans and Fox News can get the attention of half the country instead of being ousted into the street for being the party of the insane.In other countries, you would never have a party like the US GOP get any traction because everyone would dismiss their stupidity from the start. Here though, you have people like you, who say ""yes both parties are bad. Yes both sides have faults! Yes neither Obama nor Romney are perfect."" --- It provides NOTHING productive. It is completely counter-productive.All you've done is express your partisan beliefs about how you hate Obama, good job. You provided no argument, no substance, no facts.**Everyone knows everyone has faults, no one claimed Obama was a perfect angel--INCLUDING THIS POST right in the title: ""OBAMA IS NOT THE PERFECT PRESIDENT...""**"
c5uej5z,mattrad2,But Republicans actually DO have a lot of good ideas... as do Democrats. The shitty equivalency is real.
c5uevpf,executex,"Equivalency does not mean ""Party X has 3 good ideas, Party Y has 15 good ideas."" Equivalency means ""Party X and Y have 4 good ideas.""Hence, there is no equivalency.And to be honest, Democrats have hundreds of good ideas, while Republicans rarely have any good ideas."
c5uf36q,SatinHandyWipe,like....?
c5uflsb,sspaiva,"Your last statement is essentially the equivalent of saying ""Hey, I like these guys cause they think exactly like I do."" Isn't that the same close-minded thought processes that Democrats attack Republicans on?"
c5ugt5h,executex,"No it isn't. I've said Democrats have had the best and most ideas. Republicans have not. I can prove it. FDIC insurance. Social Security, Medicare, Medicaid, Food stamps, Obamacare, Glass-Steagall Act. All created by Democrats, and signed into law by Democratic presidents and probably had the most significant effects to the US than most other laws.They've created Cabinet departments, such as Dept. Of Education and Dept. of Energy. These were great ideas. Other than the EPA created by Nixon, which Republicans today want to underfund and remove, name me some things that Republicans created and supported strongly, that were incredibly great ideas that don't predate the 20th century."
c5umtun,sspaiva,"You're proving my exact point here though. You're saying that Democrats have had, what you call, the best ideas while Republicans have not. You have to realize that that's extremely subjective, and truly a matter of opinion, not fact. That's what is biased about your claims.You then went on to list examples of those ideas that you believe to be the best, without acknowledging the fact that many of those that you brought up have caused much debate and speculation throughout the past years, many of which are still occurring today. Therefore, you cannot just assume an end-all, be-all' approach and stamp your seal of approval on something and call it a great idea', without first understanding the flaws and criticisms involved with them which has sparked debate. Social Security, Medicare, Medicaid, and Food Stamps are all things that require major reform in modern times, as they are just not sustainable for the future. Obamacare is an extremely hot-topic debate, and the issues of government vs. private-run healthcare are disagreements that will occur far into the foreseeable future, I'd imagine. Glass-Steagall has even had many pitfalls within the bill, which has caused loopholes for corporations to slip through the cracks, and/or cause over-regulation for corporations that didn't previously require the heavier burden. Same thing for the Depts. of Education and Energy. Just like Obamacare, those departments have caused the ever-continuing debate of having government-run programs vs. private-run programs. Some would say that having the government in education causes positive change for lowering costs via providing grants, funds, etc, while others argue that the grants cause inflation in college tuition costs, and by bringing education closer to the local governments, tuition costs will decrease. Certainly, there are pros and cons on both sides of the issue that you have to examine, but that continues on my very point. These issues are much too multi-faceted to look at in such black and white terms. There are multiple angles and sub-issues within every debate, and in order to have an intelligent discussion about them, one must be able to understand that he/she cannot just assume these types of end-all be-all' approaches that you keep taking."
