Comment ID,Username,Comment
c5vd36f,,"How the hell is it a strawman - the whole argument started with people talking about MMJ dispensaries which is what I was referring to.And you get to throw around insults, but if I do the same thing you did, I get a lecture on what the Democratic party is doing."
c5ucydx,DrakenKor,I see you only got downvotes and no replies. Lots of shills roaming the halls of r/politics.
c5udhxw,cedurr,ANYONE WHO DISAGREES WITH ME IS A CORPORATE SHILLget the fuck out of here
c5udzz3,DrakenKor,"Hurr durr, a lengthy post with many rebuttals and varied sources gets downvoted without any replies. Who has the problem with disagreement? Plus I just saw 5 downvotes appear on my comment, and 5 upvotes on yours instantly. Funny, lol."
c5ue39h,cedurr,YOU FOUND US OUT! THE ROMNEY SHILLS ARE IN FULL EFFECT!
c5ud8v3,setyourarmsdown,"lots of them all over the internets, and they need to be called out."
c5udg0p,nicitiesnotmything,"First-rate dismantling of a weak argument, sir/madam."
c5udyyw,,Please look at my responses as well.
c5udo6v,doodlebro,"Thank you so fucking much. God I hate when you bastards try to play it off that BUSH was better than OBAMA for fucking MMJ.Holy fuck, that's one thing that reddit will not stop doing."
c5ucylo,Oryx,>The same old talking points.And the same old monocular apologist bullshit.
c5uczlp,,"Why don't you debate me and prove me wrong then, I only hear personal attacks when I point out that these talking points are coming from editorials while lacking a lot in facts."
c5ud90n,,[deleted]
c5udce5,Inebriator,"Clearly Oryx isn't even a Republican, you dipshit. Hooray for tribalism!"
c5udf1u,BinaryNinja,We're so fucked. We've been divided and conquered with partisan politics.
c5udgkt,Murse85,"Yes, we are screwed."
c5ucm63,Atheist101,"IIRC next month, some 25k soldiers are coming home from Afghanistan and then next summer all combat troops are coming back and then the year after everyone except a handful of troops to staff our bases will remain. That doesnt seem like escalation to me..."
c5ucob6,,"We shall see how many combat troops remain (""combat troops"" itself can be a deceiving term) by the end of 2014, but Obama did expand when he came into office and escalated again at the end of 2009/beginning of 2010. The results were hardly impressive from what I have seen.Anway, I believe we should be exiting faster just as groups like the Afghanistan Study Group suggested."
c5ughxq,shamrockhoax,"Out of curiosity, what military strategy experience are you basing your approved rate of exit?"
c5ugx8c,,"Look up the Afghanistan Study Group's report, but I do think it should have been faster than what they suggested, although I have no military experience of my own."
c5udi0y,underweargnome04,"http://www.dailymail.co.uk/news/article-2138104/Osama-bin-Laden-death-anniversary-Barack-Obama-Afghanistan-TV-address-Kabul.htmlwhats a us presence? contractors, drones, special ops?"
c5ueq4r,Atheist101,"Well I was kind of wrong about the bases, here is what Obama's speech says about the troops past 2014 deadline and bases.""Within this framework, we will work with the Afghans to determine what support they need to accomplish two narrow security missions beyond 2014: counter-terrorism and continued training. But we will not build permanent bases in this country, nor will we be patrolling its cities and mountains. That will be the job of the Afghan people.""I assume that means the only troops left in Afghanistan after 2014 will be the trainers and special ops."
c5ucrem,Breakyerself,After 11 years how is next summer soon enough?
c5ucynw,,Yes we.... Can't :(.
c5ucvg2,Breakyerself,You're right on the money. I doubt mitt could be much worse. Although I do expect he'd be a tad worse. it's certainly a giant douche vs a turd sandwich.
c5udkbx,MintClassic,"> it's certainly a giant douche vs a turd sandwich.I can't even begin to tell you how fucking sick I am of this trite little refrain. It was funny *once*, on South Park, a decade ago. And even then, it wasn't that funny."
c5ueweu,Breakyerself,I wasn't trying to make you laugh. I also wasn't asking your permission. I used the reference because its an apt fucking description.
c5ud0m5,sorrydaijin,"> I doubt mitt could be much worse.O ye of little faith.Given the chance, I am quite sure he would prove you very wrong."
c5uf0mx,Breakyerself,They're all the same. They all work for the same people. Elect whoever you want the agenda wont change. Maybe a few minor things at the margin will change. Then they'll blow those minor changes out of proportion to make you think there's a difference. Then you'll feel like you have a choice and your vote means a fucking thing.
c5ud6pn,clkou,"So if all that stuff bothers you, you must have been so pissed off you couldn't hardly breathe when you found out Bush started a war based on a lie and paid for with a credit card ... right?I mean, you probably could barely have contained yourself that bin Laden orchestrated 9/11 on Bush's watch and roamed free, right? Kudos to Obama for killing him, right?It's perfectly fine for the GOP to have an open strategy to oppose the president on any and every issue to sabotage his presidency and the American people be damned. Right?You could write a book longer with 'Gone with the Wind' with how screwed up the GOP is and why Obama and the left are superior in policy and leadership, but spin it however you like. Find something YOU think Obama has done wrong and then declare both sides 'the same'.Obama is about the same with the GOP as chocolate ice cream is to dog poo. Obama is the ice cream in that analogy btw."
c5ud9z9,,I never said both sides are the same necessarily. I will say I'm not a fan of plurality voting or the two party system it promotes.You noticed how I said Obama essentially ignored the illegal actions by the Bush administration? I'm not one to think two wrongs make a right.
c5ud9vg,Thegrizzlybearzombie,Nope. They are all the poo.
c5udhyb,,"You're the ice cream, girl ;-)"
c5ud8bb,,"Fair enough, but I'd be willing to bet that any of the current republican candidates would be orders of magnitude worse. Frankly, this isn't very surprising. The incumbent advantage is nearly impossible to overcome so it's not as though the serious republican candidates are going to show up this year. The next election will be interesting. (Actually, it will probably be just a bunch of idiots clamoring to vote for the republican because ""we've had too much democrat control"")"
c5udzwx,capnjack78,"I can't believe that after the bank bailout debacle that you would believe that Obama and his administration still tries to do the right thing. They're not as bad as Rmoney, but still."
c5ue27o,Old1e,"That's right, when it comes to running the nation, it's good intentions that matter. Fuck the actual results."
c5ue8pj,moosemoomintoog,At least they're not fucking the family dog.
c5ue95b,GiveMeBackMyPants,"Tries?He signed the NDAA and included a signing statement about how he agreed with the indefinite detention portion of the bill. Then, a federal judge makes a ruling that would effectively ban it. So the White House files an appeal.What the *fuck?*"
c5uec3p,fakeassposer,Tries to do the right thing? What the fuck reality do you live in?
c5v1c94,,Has this subreddit even tried to be objective?
c5uba6p,SirWhy,As an Irish dude with little knowledge on US politics I say..... Your system is fucked either way
c5ueitk,armacitis,>with little knowledge on US politics>Your system is fucked either wayYou appear to understand it perfectly actually.
c5uekfz,SirWhy,"Well looks like I should run for president in 2016.... I just need more than a decade added to my age and citizenship.... and money.... and a perfect system people won't call communist... Actually fuck it, I'm staying put here"
c5ui0q6,Afrodaddy,You actually couldn't run even with all those things. You need to be born a citizen. I'd vote for you if it's any consolation
c5ujcdh,SirWhy,"Thank you. You have to be born a citizen? I can see why, but it still just shows how it's a fucked up system. I'm not sure if it's the same here (I care little for Irish politics also)."
c5unxra,Afrodaddy,"I care little for any politics haha. But yeah, thats why when people were saying we should make the governator schwarzenegger Pres. it could just never happen. And why all the people were making a huge deal out of Obama's birth certificate, if he didn't have it he couldn't be pres. I think it makes sense why they made it that way at the founding, because you didn't want any loyalists or Brits becoming president, and it continued making sense when we became a world super power, to have an American running America. That being said I'm sure theres droves of people who aren't Native born who'd make better presidents than the ones we spit out. And it probably sucks moving to America when youre a year old and not being able to run. But i doubt many people hit that problem. Sorry for the long reply amigo"
c5unznc,Afrodaddy,"Also, were superficial as shit and having 40 white guys in a row shows that. It keeps the president ""looking"" american, as bad as that is. We vote heavily on who we could see being president.Edit: i meant to make this comment an edit... damn."
c5up2ig,SirWhy,"No problem friendo. The system works I guess, or at least it has it's pros and cons."
c5uqg5o,Afrodaddy,seems like its mostly cons these days
c5ueeka,mrkhan0127,This statement is 100% true. Romney is hiding his taxes while Obama is expanding the national surveillance apparatus... F em both
c5ubxrz,SubhumanTrash,Ok Celtic Tiger. How are the PIIGS doing? Maybe our Federal Reserve shouldn't have loaned you ungrateful assholes anything and let you crash and burn even harder.
c5uclzk,SirWhy,"Oh I know we're fucked distressed American. Doesn't change the fact that you are also fucked though. And if we seem ungrateful let me express my deepest sympathies, maybe if we got off our arses every once in awhile you wouldn't feel that way but that would take up valuable drinking time. If you excuse me I have potatoes to pull out of the..... Aww shit, blight again!"
c5ucqn1,,"Piss off, Seamus, I actually laughed at that."
c5ue7fl,luveroftrees,hahahah
c5uekxm,SubhumanTrash,"Nice try but the petrol dollar lives on! You know why? Because the only competition was pissed away because of the PIIGS that dragged it down. Just look in the mirror and repeat this, ""the only chance the world had at taking down the world reserve dollar was destroyed because of me."" HAHAHAHAHAHAHH!!!"
c5uentj,SirWhy,"You guy's should stop using petrol by the way, it ruins my countries rich landscape which is but one part of our immense culture. Sure we have no money but we'll go down partying. At the same time the oil will dry up and your precious petrol dollars will be gone. I should really stop feeding those who only wish to annoy me"
c5uguzz,SubhumanTrash,>At the same time the oil will dry up and your precious petrol dollars will be gone. Are you really that stupid? It's the world reserve currency regardless of the largest commodity. If it's not oil it'll be something else.
c5ucyx3,DrakenKor,Distressed American. Lol.
c5v0lz7,h0ncho,"Maybe if people with little knowledge would learn to shut the fuck up, things would get better?"
c5v16n3,SirWhy,Doubt they would
c5ufjlp,,"Good evening OP! I think you're a cocksucker! Here's why:1) Your post is literally just a statement. You have no evidence to back up your point, you provide no relevant information, you are literally just posting an opinion with no content whatsoever. The fact that this got to the front page of r/politics is a wonderful testament to the absurdity of America's current political climate.2) You're being extremist, dogmatic, and wildly emotional in the formulation of your ideological standing, which is the quintessential problem with American politics. Rather than approaching your decision with calm, level-headed analysis, you choose to make sweeping ad hominem arguments against an entire group of individuals. I am a huge Obama supporter, and I still maintain that people like you, regardless of political affiliation, are the reason our country's politics suck so fucking hard."
c5upkvc,sspaiva,http://i.imgur.com/lWPdJ.png
c5ub725,mttwldngr,Right...
c5udhfp,airbornemaniac,"I really don't like either candidate this election. But what would help is if Romney and Obama sat down and went through point by point of their stance on key issues, without saying the others name or ""my opponent"""
c5uclhw,Coredrill,So brave.
c5uczsh,,Broshave?
c5ud1ng,,"Oh fuck off. Let's stop the circlejerk. If you manage to be part of the US Congress, you're highly motivated, charismatic and able to function with others.This qualities alone will guarantee you a far higher salary than congress/wo/man.The simple fact is that the republicans are there just as much as the democrats, they're trying to fix things wrong with you country.They disagree about the way to do it but to say that the only reason they became congress/wo/men was to pad their pockets makes you look like a moronic, partisan hack."
c5ufh57,oconnellc,"Wait, you think the real money from being in congress comes from the salary?"
c5uj5q8,rubberstuntbaby,"The payoff for being in congress is through insider trading and getting a collecting a huge paycheck when you leave congress to go ""work"" for the companies you let write your bills for you."
c5udflq,TrueBlue0276,Still waiting for someone from BP to be prosecuted. Still waiting.....
c5udcwg,funkutoo,"After reading the title, I had to look up how to spell NAVET."
c5udk25,ElCidVargas,Guys I know I'm going to be downvoted... butDAE THINK ROMNEY BAD?
c5udxhu,,[deleted]
c5uewrh,theyoyojo,This feels like /r/circlejerk
c5ukyvn,epicwinguy101,"I think this outdoes them. There isn't even any contained text, just the outrageous title."
c5ubeko,,How has Obama tried to do what's right?
c5uc9x1,wurtis16,"YEAH HE DIDN'T LEGALIZE POT, LOL MAO (10) BBQ"
c5udll8,623463426362,You come off as *much* more immature than those you mock.
c5v0re5,wurtis16,"-retypes 5 times, checks grammar online, submit-"
c5ue13h,futur1,it's between a turd and sandwich. But that shit sandwich has hidden rusty nails in that will give you AIDS.
c5ue9e9,glutenfree123,"I mean I agree that Romney and Republicans only care about their bank accounts but using ""at least Obama tries to do the right thing"" as a means to justify support for him is not any better than the Republican base that just votes on variants of words like Jesus and America."
c5ueeaa,blackjackjester,"I personally disagree with most of his policy, but at least i can tell that his policy comes from his idea of the right thing to do for the country. I respect this. Romney just sounds like he wants to slash programs just for the sake of it, while expanding government in unproductive ways. I cant see a positive outcome under Romney"
c5ueq7e,existentialcwby,the only true part of your post was the second sentence. god help you.
c5uetw2,KMoneyThunder,"Well...that's just like, your opinion, man..."
c5ughda,gentlemandinosaur,"Here we go.I am going to vote for Obama in November. I am. But, killing 3 Americans with robot planes without trial or tribunial is as close as you can get to not the right thing as you can get. Killing an enemy hors de combat in strict violation of Protocol I of the Geneva Convention in a country (hint rhymes with Mackastan) we were not even involved in a war with is about as not the right thing to do as possible. These are NOT right. They are NOT justified. And they are about as UNAmerican as you can get. But, the alternative for me could be potentially even worse. But, I hate my choices. I don't care if you downvote the shit out of me. I know what is right and what is not. And none of these answers are right."
c5uh25w,,keep stroking your cock dude
c5uiq5q,Abe_Vigoda,"Both sides are funded by multinational companies and corporations that barely pay taxes, shift all their jobs to Asia or some other shitty country where they can exploit the workforce without pesky unions or human rights groups bugging them.These companies don't give a damn about the average public citizen unless they can find some way to profit off them.They own the media which is a lot more than just tv. Music, movies, magazines, books, newspapers, internet news sites, radio stations, and more. They control which candidates become president. Not you.Obama sucks. Romney sucks more. Could you find 2 more polarizing people? Obama will win because Romney is only meant to make the Republicans look bad.He's a phony. Fixed horse in a fixed race.The US will never have true democracy unless you break up the media conglomerates, put a new focus on honest journalism, and remove the money from campaign funding."
c5uiv65,,Yup...fire bombing innocent civilians with drone strikes is the right thing...
c5ujmvz,Tiger337,"Obamacare is better than the Republican ""I Don't Care""."
c5um73d,FieldMarshall316,"Like Biden said ""show me your budget and I'll tell you what you value"", take a look at Mitt's & Ryan's budget and you tell me what they value."
c5upysc,SandmantheMofo,"Republicans believe in other things too, like cramming christianity down peoples throats, building really expensive weapons to use on brown people, and keeping women barefoot and pregnant."
c5ubkqw,WurzelGummidge,"Pah, who needs the the Republican Party anyway, Obama is cheerfully doing what the neocons want."
c5uctrn,,I just picked my favorite neocon and this is what he wants.>The only other option is to take pre-emptive military action to break Iran's nuclear weapons programhttp://www.usatoday.com/news/opinion/story/2012-01-17/John-Bolton-Iran-military-action/52623920/1So when did that happen?
c5ucx64,Rumple_Manskin,A gigantic sample size of one whole person. Very convincing.
c5ucy5e,,"First, where is the poll regarding what neocons want? Second, is there a bigger neocon than Bolton?"
c5uidxd,rcchomework,he's using the word neocon without knowing what the word means. It's pretty hilarious.
c5uekbw,executex,"Bullshit! As usual in /r/politics where conservatives are in great numbers this year and lying about Obama in every comment.Mitt Romney wants war with Iran. Mitt Romney traveled to Israel to gain more support and talked tough about Iran, where Israeli prime minister accused Obama of being weak on Iran.Obama advocated diplomacy with Iran and even the Iranian leaders agreed he was better than Bush and the Republicans."
c5udtuu,uberbob79,Ask the children his drones blow up their opinion
c5ueep4,stewbeef,"The problem with this country is the ""us vs. them"" attitude of liberals and conservatives alike. This is a problem even the founding fathers warned against that arises when political parties come to be. If you can associate with a team, you can associate against one. The biggest problem in our country (and with the most recent elections) is that when it comes to the media (whether fox news, msnbc, cnn, or many papers/internet sources) there is an intentional effort on the part of executives and the editors they control to steer public opinion away from meaningful issues and toward divisive, frightening, and enraging distractions that boost ratings. These, from both sides, distract you from the fact that policies of Obama are ineffective or the budgets proposed by Romney and Ryan are dangerous for the future of America. Our country is built on greed, so it's not surprising that around half the population (conservative or not) is pissed they lose money to taxes, want to pay less, and want to make as much money as possible. But it's also a great point to make that when it comes to netting 6 million dollars in a year as opposed to 8, it's not socialism. Those two million dollars prevent the fights over money and groceries in my middle class home, prevent the bankruptcies and foreclosures because the middle class boosts the economy and therefore creates the jobs. Lower the middle class tax rate and everyone's happy. TL;DR: everyone's selfish; everyone needs to think more."
c5uj72l,Stoy,Two-party system == fucked.
c5udfae,,"""Obama tries to do the right thing?"" The fuck is that supposed to mean? We've lost more personal freedoms under Obama than Bush! Sure he's not some social darwinist cunt, but you don't think he's in the pockets of business lobbyists? Check out the insurance company dollars that went into lobbying for Obamacare.EVERYONE has an agenda, EVERYONE with a shred of real influence is as good as bought and paid for. Look up the Bohemian Grove: http://en.wikipedia.org/wiki/Bohemian_GroveRe-elect nobody.http://www.reelectnobody.org/"
c5udw9s,AzzyIzzy,"What social Darwinist? Also personal freedoms.. There are quite a few freedom that even philosophically can be allowed, but generally when you reason through them, and even more so live from them, things never turn out quite so nice.This is just the ultimate culmination of making a society based on freedomsXD(or at least what we perceive to be democratic freedoms). Eventually all the freedom's will disappear."
c5udmdz,ZzCARLOSzZ,"You talk about the Republicans as if they are all bad, hell maybe they are, but Ron Paul is one of the only Republican's who actually want to change and fix this corrupt system! Yet Reddit smashes him and calls him crazy...it's really sad what kinda community we have become."
c5ugref,Kharos,"The doctor can diagnose, but he can't prescribe. He's still stuck with the equivalent of leeching."
c5udpgu,Pimptech,Don't lump Ron Paul in with the Republicans. He only joined their ballot because he knew there was no way he would get any attention as an Independent.
c5udwrc,ZzCARLOSzZ,"Are you insane? Ron Paul represents what the republican party use to stand for, as he's stated, the party has lost its way, >""Because the conservative wing of the Republican Party always advocated a non-interventionist foreign policy. Senator Robert Taft didn't even want to be in NATO. George Bush won the election in the year 2000 campaigning on a humble foreign policy. No nation building. No policing of the world. Republicans were elected to end the Korean War. The Republicans were elected to end the Vietnam War. There's a strong tradition of being anti-war, in the Republican Party. It is the constitutional position. It is the advice of the founders to follow a non-interventionist foreign policy. Stay out of entangling alliances. Be friends with countries. Negotiate and talk with them and trade with them. Just think of the tremendous improvement of relationships with Vietnam. We lost 60 thousand men. We came home in defeat. Now we go over there and we invest in Vietnam. So there's a lot of merit to the advice of the founders to follow the Constitution. And my argument is that we shouldn't go to war so carelessly. When we do, the wars don't end."">"
c5ui6pz,Pimptech,So Bush taking us into 2 wars is the Republican way of getting us out of wars? Republicans are anti-war? That is a stupid comment. Republicans are always the ones pushing the budget for the DOD not Dems. The Constitution is outdated. We need a new system.
c5un18h,ZzCARLOSzZ,"Like i said, Paul represents what the Republican party **used** to be."
c5udtr5,,Voting for Mitt Romney is like hiring the guy that robbed you to design your security system in your house. Romney supports the reinstatement of the atmosphere that allowed the 2008 economic crisis to happen. Laissez faire financial sector- I have no idea how people can be so blind on how they're pretty much stealing the wealth from this country.
c5uenuz,Fizjig,"I do not claim to be a Democrat, and I have been open minded to hearing ideas from Republicans. Here is the problem I run into. Many Republicans force feed their religious views into everything they do. At times they do this to the detriment of their own party, because frankly, many people who claim to have Christian values don't understand the concepts their own religion teaches. Paul's writings in the Bible, and the teachings of Jesus are not one and the same. There are fundamental differences between the two that contradict each other. Instead of understanding their faith and trying to come up with an educated opinion of their own on the subject, they choose to tow an ignorant party line that makes them sound like uneducated assholes. I believe, at their core people with Republican views have good intentions. I just feel that their party has become so extremist that it is hard to take anything they say at face value. Romney comes across as an Arrogant fuck that will lie, beg, cheat, steal, and sell your mother to win the election. Maybe that's not a fair view, but it is the reputation he has built in many peoples eyes. Even John McCain is like WTF is wrong with this guy. Instead of putting forth a decent candidate people on the Republican side are willing to vote for this clown simply, because he is not Obama. That's like gouging out your eyes, so that you don't have to wear glasses. If you want people to stop bashing your party then get some representatives in your party who are not batshit crazy, extremists. One more thing. Insulting the hell out of the people you are trying to convince to see your point of view is a terrible way of gaining support for your cause. If you read this post and got offended by it then you know exactly what I am talking about. Cut that shit out."
c5uex50,TheClayroo,"DO NOT EDITORIALIZE!!!! FIRST RULE!!! C'mon Mods, I know you're probably liberal, but don't make a rule and not enforce it."
c5ufb3x,Raiancap,"That rule does not include self-posts, so OP is within the rules."
c5ufcqo,TheClayroo,"Ahhhhh...ok then, I digress. Apologies OP."
