Comment ID,Username,Comment
c5ud4a8,,"The article you link to is titled Obama's War on Pot and Nadelmann's opinion while worthy of respect is not the end all be all. I recommend everyone read that article and make up their own mind.""Obama, who recently said he doesn't ""mind a debate"" about drug legalization, has increased the crackdown on medical marijuana producers across the nation, including a recent high-profile raid on a California training school. He addressed the crackdown and attempted to clarify his 2008 comments that he was ""not going to be using Justice Department resources to try to circumvent state laws [on medical marijuana]""Attorney General Eric Holder was a guest of The Huffington Post at the correspondents' dinner. Before it began, a HuffPost reporter noted to Holder that Obama's reference to ""congressional law"" was misleading because the executive branch could simply remove marijuana from its ""schedule one"" designation, thereby recognizing its medical use.""That's right,"" Holder said""http://www.huffingtonpost.com/2012/04/28/jimmy-kimmel-whcd-pot_n_1462140.htmlMy point is that the sanctions Obama pushes harm ordinary Iranians far more than leaders like Khamenei:http://www.guardian.co.uk/world/2012/aug/10/sanctions-iran-ordinary-people-targethttp://www.newsday.com/opinion/oped/opinion-sanctions-against-iran-hurt-the-people-not-the-regime-1.3881126http://www.pbs.org/wgbh/pages/frontline/tehranbureau/2012/07/news-health-group-sanctions-put-tens-of-thousands-of-iranian-children-at-risk.htmlhttp://www.aljazeera.com/indepth/opinion/2012/07/2012710132416172713.html?utm_content=automate&utm_campaign=Trial6&utm_source=NewSocialFlow&utm_term=plustweets&utm_medium=MasterAccounthttp://www.thedailybeast.com/articles/2012/03/20/sanctions-will-lead-to-war-not-prevent-it.htmlThe consensus among the international intelligence community is that Iran is not currently pursuing weaponization. They may very well be leaving the option open, which is what many of these intelligence agencies believe.In the most recent round of talks I believe Iran offered to stop 20% enrichment in exchange for the recognition of its rights to enrich and the scaling back of sanctions. The US refused this.Iran also does have a right to enrich to 20% in order to build research reactors, so while it may be concerning it should not be used to justify drastic action.Did you read the WaPO article on Gitmo? You may think it is inaccurate, but one key point is that Obama made a lackluster effort to close Gitmo.Politifact says: ""It also establishes a ""periodic review"" process for for long-held Guantanamo detainees who have not been charged, convicted or designated for transfer, ""but must continue to be detained because they 'in effect, remain at war with the United States,'"" according to a White House fact-sheet.""How does the White House esablish this? They can be detained indefinitely without trial. How nice.LBJ had many problems of his own and legislative success does not necessairly mean that the legislation will be successful. Obamacarae is unlikely to to do much to keep healthcare spending under control (this does not mean I think it will increse the debt) and many financial analysts believe Dodd-Frank is insuffieicient to stop future crises.Update: Did you actually read the links on Climate Change I provided or just post links that presented Obama in a favorable light on this issue? While I do get upset from Obama from time to time I certainly don't think he is aboslutely awful. I just don't think he is anything special. Obama also has focused on cap-and-trade rather than a carbon tax, which many analysts believe would be far better."
c5udyd1,doodlebro,"I want you to shut the hell up about ""Obama's war on MMJ"" and listen here.In the last year or so, the DEA has closed about 60 dispensaries in Colorado, and a handful in California. Before that, since when Obama was inaugurated, not many were closed at all.All of the dispensaries in Colorado were closed for being within 1000 feet of a school zone. This is a felony offense. The law to not sell drugs within 1000 feet of a school zone was signed into the books in the **BUSH** administration as a part of No Child Left Behind. Do you know how many dispensaries are still open in Colorado? At least 1000. 60 out of 1000 is roughly *6%* of the total dispensaries. And you're telling me Obama is better for MMJ than Bush?Wait, wait, this gets better. Some dispensaries in California were closed for the same reason, within 1000 feet of any school. Most of them, however, were closed for violating state MMJ laws or violating **LOCAL** MMJ laws. Certain cities and districts flat out banned dispensaries. When those dispensaries didn't move, you know who swooped in? ***The motherfucking DEA.*** Obama said that he wouldn't have federal resources wasted on *LAW ABIDING* dispensaries in MMJ states.So, do you know how many dispensaries are still open in California? THOUSANDS.I don't see where you get your logic for this, but I'm going to tell you that you're flat out wrong. Obama has been fabulous on the issue of MMJ thus far by not bothering patients or law abiding dispensaries. Clearly the small percentage that were closed were doing something wrong, it wasn't a ""war on pot"""
c5uj9ta,rubberstuntbaby,And why couldn't Obama let these states handle it?
c5umugv,doodlebro,"For one, Obama is not sitting there deciding that the DEA should raid this dispensary, and that dispensary. If the dispensaries are breaking any laws, they will be closed down by the DEA. It's that simple. Who cares why the local enforcement agencies aren't doing it?"
c5v3zry,,"Obama SPECIFICALLY said his DEA wouldnt bust anyone following state and local laws. And then he did:the operation raided Thursday, Northstone Organics in Mendocino County, has been touted as a model medical marijuana grow. It holds a Mendocino County sheriff's permit to grow the 99 pot plants seized and destroyed by the feds, pays an estimated $8,500 annually in fees to remain compliant, and has even had sheriff's deputies testify favorably about it in a state court case where Northstone drivers delivering medicine to patients were arrested in Sonoma County."
c5v1clz,,"Don't be to harsh on him, his job is to repeat talking points."
c5v2i7h,,>Obama said that he wouldn't have federal resources wasted on LAW ABIDING dispensaries in MMJ states.And that has been shown to be a lie. They have busted NUMEROUS dispensaries and co-ops that have been following the letter of the law. http://www.theweek.co.uk/crime/47303/why-barack-obamas-marijuana-betrayal-should-surprise-nobodyhttp://www.huffingtonpost.com/scott-morgan/obama-must-explain-his-br_b_1020910.html
c5v34nc,doodlebro,How do you even explain that 90% of dispensaries are still open and have not been contacted or raided by the DEA? Hmmm?
c5v39gj,,"How do you think that relates? Obamas promise wasnt ""i wont bust more than 10% of legal dispensaries"". It was """"I'm not going to be using Justice Department resources to try to circumvent state laws on this issue"".He lied. It is a broken promise. The DEA busted a MODEL co-op, that followed every single state and county rule, against the wishes of local law enforcement. Your argument doesnt address that.http://www.rollingstone.com/politics/news/obamas-war-on-pot-20120216"
c5v3ovm,doodlebro,"None of your sources address it either. Fuck. All of your sources ambiguously talk about a few closed down here and there. Try using your brain. If a small number of dispensaries are closed down, they're probably doing something wrong that the other 90% are doing right.NONE of your sources address that these dispensaries were law abiding. Simply put, they weren't."
c5v3x1n,,"""NONE of your sources address that these dispensaries were law abiding""Well, thats a lie. *""the operation raided Thursday, Northstone Organics in Mendocino County, has been touted as a model medical marijuana grow. **It holds a Mendocino County sheriff's permit to grow the 99 pot plants seized and destroyed by the feds**, pays an estimated $8,500 annually in fees to remain compliant, and has even had sheriff's deputies testify favorably about it in a state court case where Northstone drivers delivering medicine to patients were arrested in Sonoma County.""*http://stopthedrugwar.org/chronicle/2011/oct/14/dea_raids_california_colorado_meObama stated he wouldnt go after anyone following state and local laws. Then the DOJ went and did PRECISELY THAT. There are SEVERAL examples cited in my links. Your assumption that the DOJ doesnt bust anyone not breaking the law is just stupid. I hope one day you wake from your apologist delusions and see Obama is a liar, just like all the others."
c5v49t6,doodlebro,"Are you really going to get me to believe they got ONE dispensary that was following laws and closed them down? Like I said, look at the number of dispensaries still open. You can't look at the one that got closed as ""OH SHIT, DEA UP IN HERE, RAIDING EVERYBODY."" Christ, look at the fucking GROWTH RATE of dispensaries under Obama. You can't explain that!"
c5v4dnc,,"Now you are attacking straw men. Obama explicitly stated he would not go after anyone following local laws. I then provide an example of that specific thing happening, and then you claim that, well, ""They must have been breaking the law"", even though there has been no evidence provided that they were breaking local or state laws. THEN, you change the parameters again and say, ""Well, he only busted SOME law-abiding growers""The fact remains: **Obama said he wouldnt go after people following local and state regs, and then he did.** You can talk circles around that all day. He lied."
c5v4nhb,doodlebro,"And you can talk circles around your pointless argument all day. The point is, he has left patients alone, and he has left a VAST majority of dispensaries alone. You can't look at a news article clearly biased against Obama to know that dispensary was following every law. They probably weren't considering that ONE dispensary was specifically targeted."
c5v5105,,"No, he hasnt ""left patients alone"". One of the examples i provided to you was of a patient-run co-op. That left hundreds of patients without medicine. So that is just one more untruth from you. Shall we continue?"" You can't look at a news article clearly biased against Obama to know that dispensary was following every law.""Cite me evidence it was in violation of any local laws. The Feds dont even make that claim. There only contention was with them violating FEDERAL law. Even the local sheriff says he was upset by the raid, **because the STATE and county Sheriff had no qualms with the co-op, because it was entirely within the law.**"
c5v5l3h,doodlebro,"So those patients had to move to a new dispensary. There are tens in the vicinity of that one. Not attacking patients. It doesn't matter that the county sheriff and state had no ""problems"" with the dispensary. The **FEDERAL** government can enforce any laws, including state and local. If the war on pot was ""ramping up,"" we'd see more than 5% of the dispensary base closed down. It's that fucking simple."
c5v5wlk,,"""The FEDERAL government can enforce any laws, including state and local.""You are making a mockery of yourself at this point. Seriously, stop.In addition to that being laughably false, as I already pointed out to you, the Fed said their only contention with the co-op was it was in violation with FEDERAL law."
c5v6c9y,doodlebro,"God you are impossible to argue with. My point is, you can't look at one dispensary being closed down while the other thousands are left alone and say that they weren't doing something wrong. When the feds start closing down every dispensary, I'll be worried and upset. For now? I couldn't give a fuck when there are hundreds of dispensaries open around me."
c5v6fnv,,"Not even the Feds claimed the co-op was in violation of anything other than Federal law. NOT STATE OR LOCAL That is a direct contradiction from the Administrations previous promise.You have a predetermined conclusion and arent even looking at the facts.To re-eit. The Obama Administration clearly stated they wouldnt bother with people in compliance with local laws. I provided you with several examples of them doing exactly that, and your response is to say they didnt shut them all downSo, basically, you dont mind that the Administration broke their promise."
c5v6hq8,doodlebro,"Uhhh, with one dispensary? Not at all. When they attack all of the dispensaries, I'll mind. I really think that co-op was doing something fishy, why else would the feds target them?This isn't rocket science. Good day sir."
c5v6ki0,,""" why else would the feds target them?""The Feds specifically stated that they went after them for violating FEDERAL law. It is in the article i linked to.Every claim you have made i have refuted WITH EVIDENCE, and you just keep moving the goal posts.I honestly feel sorry for you."
c5v6rr9,doodlebro,"Damn dude, I feel sorry for you :(The claims I have made are IRREFUTABLE. Wanna know why? Because the feds aren't attacking a bunch of dispensaries. It's a fucking fact.Seriously, get it through your thick skull. If the feds raided them for breaking federal law, then that's that. Do you know which law they broke? Probably not. But I'm not gonna sit here with you and think ""Oh, the feds must be full of shit for closing ONE dispensary in California. No way they were breaking any laws, right guys, RIGHT??!!!""I *said* **good day sir.**"
c5v8948,,"So, when the Obama administration said they would not go after ANYONE who was not violating local and states laws, and then DID just that, you say ""well, they didnt shut them ALL down""Brilliant. You, sir, are tagged as ""stupid as fuck"""
c5v8blq,doodlebro,"Again (and probably the 5th time today I've had to explain this to your small brain), When 95% of dispensaries are still open and untouched by the feds, it's really hard for me to be angry with them for closing a few here and there. There were reasons they were shut down. I don't care what law it was they were violating, they were shut down for it. It's not a big deal when such a small number are closed.You've been tagged as stupid as fuck, probably by many people before me."
c5v8gvj,,"*""I'm not going to be using Justice Department resources to try to circumvent state laws on this issue,""* Obama vowed, promising an end to the Bush administration's high-profile raids on providers of medical pot, which is legal in 16 states and the District of Columbia.-2008In March 2009, Attorney General Eric Holder emphasized that the Justice Department would only target medical-marijuana providers *""who violate both federal and state law.""*The, they turned around and did EXACTLY THAT.I also used to blindly offer apology after apology for the Obama Administration. Then I realized i sounded like those Bush guys defending the Iraq war."
c5v8mbm,doodlebro,You aren't even making sense at this point.
c5v406e,,"""Obama said that he wouldn't have federal resources wasted on LAW ABIDING dispensaries in MMJ states.""And then he did EXACTLY THAT http://stopthedrugwar.org/chronicle/2011/oct/14/dea_raids_california_colorado_me"
c5udc5l,,">The article you link to is titled Obama's War on Pot and Nadelmann's opinion while worthy of respect is not the end all be all. I recommend everyone read that article and make up their own mind.So the content and direct quote coming from one of the most prominent figures when it comes to fighting the drug war is less important than the title of the article?Between, why is MMJ the standard for drug war? Do you know that many of these dispensaries FOUGHT legalization efforts in California? http://reason.com/blog/2010/09/22/medical-marijuana-supporters-aIf we are talking about what Obama did on the drug war - why not mention this? Surely, profits of MMJ dispensaries is irrelevant compared to the fact that Obama released 12000 prisoners (mostly minorities) and pushed for non-violent drug offenders to avoid jail.[Reduced disparity in sentencing for crack and cocaine](http://www.politifact.com/truth-o-meter/promises/obameter/promise/299/eliminate-disparity-in-sentencing-for-crack-and-co/) which led to[the U.S. Sentencing Commission unanimously voting to retroactively apply the Fair Sentencing Act of 2010, enabling 12,000 prisoners who were convicted under a previous law that applied harsh sentences to minor crack offenders to be released](http://thinkprogress.org/justice/2011/07/01/258642/prisoners-released-rectify-unfairness-drug-policy/)[Send first-time nonviolent drug offenders to rehab where appropriate instead of sending them to prison](http://www.politifact.com/truth-o-meter/promises/obameter/promise/414/send-first-time-nonviolent-drug-offenders-to-rehab/)>My point is that the sanctions Obama pushes harm ordinary Iranians far more than leaders like Khamenei:Iran did sign the NPT, if they do get to manage nuclear capabilities then the hardened world reaction (especially Israel's) will be much more harmful to ordinary Iranians.>The consensus among the international intelligence community is that Iran is not currently pursuing weaponization. They may very well be leaving the option open, which is what many of these intelligence agencies believe.Actually, it's the same consensus from the Obama administration and the idea is to keep that way.http://www.rawstory.com/rs/2012/01/09/panetta-admits-iran-not-developing-nukes/>Did you read the WaPO article on Gitmo? You may think it is inaccurate, but one key point is that Obama made a lackluster effort to close Gitmo.Can you explain what exactly he could have done other than signing the executive order given that it was the Democratic Senators who made a big issue of it at the time. >How does the White House esablish this? They can be detained indefinitely without trial. How nice.Actually it does work, according to ACLU[Obama took Ali Al Mari and Umar Farouk Abdulmutallab out of indefinite detention and criminally charged them, found new homes for some detainees transferred from Guantanamo and has not sent new detainees to Guantanamo or created new military detention facilities.](http://www.aclulibertywatch.org/ALWCandidateReportCard.pdf)>LBJ had many problems of his own and legislative success does not necessairly mean that the legislation will be successful. Obamacarae is unlikely to to do much to keep healthcare spending under control (this does not mean I think it will increse the debt) and many financial analysts believe Dodd-Frank is insuffieicient to stop future crises.What caused the crisis? It was the unregulated $60 trillion credit default swap fiasco. Now Dodd-Frank does these things - [Wallstreet derivatives must be traded transparently through a clearing house](http://www.davispolk.com/files/Publication/7084f9fe-6580-413b-b870-b7c025ed2ecf/Presentation/PublicationAttachment/1d4495c7-0be0-4e9a-ba77-f786fb90464a/070910_Financial_Reform_Summary.pdf), [defined the amount and nature of wallstreet assets required to meet capital requirements](http://www.davispolk.com/files/Publication/7084f9fe-6580-413b-b870-b7c025ed2ecf/Presentation/PublicationAttachment/1d4495c7-0be0-4e9a-ba77-f786fb90464a/070910_Financial_Reform_Summary.pdf), added regulation that states [originators of asset-backed securities must retain 5% ownership/risk](http://www.davispolk.com/files/Publication/7084f9fe-6580-413b-b870-b7c025ed2ecf/Presentation/PublicationAttachment/1d4495c7-0be0-4e9a-ba77-f786fb90464a/070910_Financial_Reform_Summary.pdf)And plus the fact that CFPB is functioning to have more oversight over mortage markets.I am sure there is a more perfect solution that financial analysts believe exists (I used to be one of them) but I would like someone to explain how all this is insufficient."
c5udyci,,"The content of the article is mostly pointing out how aggressive Obama has been. Why did you ignore Holder's quotation? Why not change it's designation?Reason is highly critical of how the Obama dministration has handled drug policy: http://reason.com/blog/2012/07/31/obamas-drug-czar-lies-about-the-war-on-dHave you read the article? Here is a small snippet:""For more than two years, the White House's plans had been undermined by political miscalculations, confusion and timidity in the face of mounting congressional opposition, according to some inside the administration as well as on Capitol Hill. Indeed, the failed effort to close Guantanamo was reflective of the aspects of Obama's leadership style that continue to distress his liberal base  a willingness to allow room for compromise and a passivity that at times permits opponents to set the agenda.""I'm really surprised about your response to the harm sanctions are doing to ordinary Iranians. Because Israel might prematurely attack Iran, which will lead to suffering among Iranian civilians that we have to essentially preempt it through sanctions? Did you think the sanctions in Iraq that ended up killing hundreds of thousand were justified?The ACLU gave Obama a one torch/star (it's right at the beginning of you link) on closing Gitmo and ending indefinite detention. They are highly criticial of Obama in this area. Politifact also said it was a broken promise by Obama in the link you provided.Obama hired Geithner and Summers who were in positions of power before the crisis and helped cause the crisis. Gethner, less so, but still he was in an important position of power (President of NY Fed) and served under Summers when he Secretary of the Traeaury under Clinton. Obama also kept Bernanke for that matter.I don't think Dodd-Frank is terrible, but it just does not do nearly enough. Obviously, all of this does not fall on Obama, but Too Big to Fail is still an issue and Obama has refused to call for the break up of these banks.Dodd-Frank does have issues though:http://www.propublica.org/article/from-dodd-frank-to-dudhttp://www.bloomberg.com/news/2011-10-10/too-big-to-fail-not-fixed-despite-dodd-frank-commentary-by-simon-johnson.htmlhttp://dealbook.nytimes.com/2011/08/03/is-dodd-frank-overdue-or-overkill-2-dueling-views/http://www.nakedcapitalism.com/2012/03/dallas-feds-fisher-criticizes-dodd-frank-as-not-going-far-enough-on-tbtf.htmlFrom the last link:""He calls for higher capital levels at the biggest banks and argues they should reduce dividends. He also doubts that Dodd Frank resolutions will work: Will the new resolution procedures be adequate in a major financial crisis? Big banks often follow parallel business strategies and hold similar assets. In hard times, odds are that several big financial institutions will get into trouble at the same time.14 Liquid assets are a lot less liquid if these institutions try to sell them at the same time. A nightmare scenario of several big banks requiring attention might still overwhelm even the most far-reaching regulatory scheme. In all likelihood, TBTF could again become TMTFtoo many to fail, as happened in 2008. A second important issue is credibility. Going into the financial crisis, markets assumed there was government backing for Fannie Mae and Freddie Mac bonds despite a lack of explicit guarantees. When push came to shove, Washington rode to the rescue. Similarly, no specific mandate existed for the extraordinary governmental assistance provided to Bear Stearns, AIG, Citigroup and Bank of America in the midst of the financial crisis.15 Lehman Brothers didn't get government help, but many of the big institutions exposed to Lehman did.16 Words on paper only go so far. What matters more is whether bankers and their creditors actually believe DoddFrank puts the government out of the financial bailout business. If so, both groups will practice more prudent behavior The pretense of toughness on TBTF sounds the right note for the aftermath of the financial crisis. But it doesn't give the watchdog FSOC and the Treasury secretary the foresight and the backbone to end TBTF by closing and liquidating a large financial institution in a manner consistent with Chapter 7 of the U.S. Bankruptcy Code (see Box 1). The credibility of DoddFrank's disavowal of TBTF will remain in question until a big financial institution actually fails and the wreckage is quickly removed so the economy doesn't slow to a halt. Nothing would do more to change the risky behav- ior of the industry and its creditors."""
